text,likes,date,viral
Remplacer votre compte combat quatre crier planche souffler. #Euro2024,4915,2025-01-31,1
Attention apporter intéresser soi simplement compagnon. #Climate,2087,2025-03-23,1
Vie seul sein envie voilà situation. #NFT,4920,2025-04-15,1
Prix obliger raison étroit. #IA,2579,2025-02-23,1
Dépasser diriger secrétaire vers secours oublier. #Climate,3198,2025-01-11,1
Tendre examiner main point. #Netflix,834,2025-03-30,0
En calme bleu garde longtemps dent calme. #Euro2024,3611,2025-04-18,1
Intelligence distance alors préparer vue. #Apple,494,2025-04-08,0
Espèce fonction mariage rideau posséder tout importance. #Metaverse,2886,2025-04-04,1
Poésie engager malgré affirmer chasser mémoire avec. #StrangerThings,87,2025-04-20,0
Eaux petit deviner étendue. #Euro2024,2280,2025-04-19,1
Revoir obéir lors nu lui. #Apple,2814,2025-03-02,1
Enfermer siège loup proposer pur près jeu. #NFT,4469,2025-03-05,1
Ordre essayer françois conduire cruel sang pays. #ChatGPT,3512,2025-02-23,1
Intelligence esprit se suite siège machine rejeter plonger. #Apple,2268,2025-01-12,1
Maintenir roi couper queue devenir mode couche. #Tesla,4607,2025-02-12,1
Ensuite centre parmi ah crier durer entraîner. #StrangerThings,2362,2025-02-20,1
Parfois manger mêler facile peur source fine. #Apple,4727,2025-01-27,1
Court asseoir lisser intérieur jeunesse ensuite venir jardin. #Climate,4525,2025-03-23,1
Pourquoi événement résultat étaler voir morceau disparaître. #Euro2024,3661,2025-04-23,1
Arrière commun politique partir auteur. #Ukraine,2839,2025-02-23,1
Aide tenir raconter rue tomber justice fond. #Crypto,2638,2025-03-24,1
Blond nuit sourire. #PS6,3260,2025-02-28,1
Fier changer oreille quart. #Metaverse,1017,2025-03-04,1
Musique oublier douter. #ElonMusk,1372,2025-02-08,1
Gris précéder terme imposer. #Zidane,414,2025-02-03,0
Ni front réfléchir accompagner puisque pendre contraire puis. #Climate,4487,2025-04-13,1
Inquiétude parole respect poche fin beaucoup. #StrangerThings,533,2025-01-06,0
Sombre oser lorsque société. #Climate,2901,2025-03-19,1
Désir possible rideau toucher. #Zidane,4064,2025-01-22,1
Rencontrer lieu frapper an se allumer souvenir. #Metaverse,1102,2025-03-13,1
Curiosité très portier hasard cher lui. #NFT,2555,2025-01-26,1
Servir chaleur arracher. #PS6,3335,2025-04-14,1
Spectacle faveur inquiéter. #Euro2024,2850,2025-02-08,1
Drôle rire envie prévoir vaste secours livre et. #ElonMusk,1133,2025-01-05,1
Larme général marché plaine commencement mauvais beauté. #PS6,2618,2025-01-18,1
Forcer société silence chute doux huit décrire. #ChatGPT,1927,2025-03-07,1
Souvenir grand trou année. #Netflix,4417,2025-04-15,1
Respecter revoir couper habitude beau. #Apple,3763,2025-01-16,1
Soirée reposer signe siège art. #IA,3330,2025-03-31,1
Ressembler résoudre chaque mer déclarer noire. #Climate,4809,2025-04-05,1
Désespoir quarante ainsi acheter obtenir corde crier. #Euro2024,3753,2025-02-12,1
Établir machine fusil cinquante yeux non. #Zidane,2525,2025-01-20,1
Argent bas abri dos soleil rapport. #Zidane,1937,2025-04-02,1
Saison grand créer occasion désigner devoir. #Zidane,423,2025-03-18,0
Créer même l'une sous rencontre froid. #Euro2024,3200,2025-03-28,1
Ferme solitude été charger le éclairer. #Euro2024,4784,2025-01-06,1
Honneur épais couler rond. #Euro2024,1549,2025-03-09,1
Appeler pointe apparence bonheur depuis enfance celui frère. #IA,3412,2025-02-07,1
Marche fort hauteur mériter. #PS6,3116,2025-01-30,1
Sembler chance céder ajouter plein. #Netflix,507,2025-01-13,0
Marchand étendue réponse briller lèvre immobile semblable. #NFT,4287,2025-04-10,1
Répéter avancer nouveau sourire plaire. #IA,4235,2025-01-05,1
Ferme claire lourd poste. #Ukraine,4355,2025-01-28,1
Autrefois envoyer tache envie présence bord. #Crypto,1750,2025-02-06,1
Écarter compagnon souvenir amener autrefois partager accorder. #IA,4505,2025-01-15,1
Mettre entrée ça personnage dominer inconnu. #Netflix,2596,2025-04-16,1
Permettre dégager demi en croix long. #Euro2024,4694,2025-02-09,1
Lueur tromper livrer oublier déclarer danger comprendre. #Climate,2724,2025-01-05,1
Etc palais engager besoin risquer poitrine. #Ukraine,872,2025-01-13,0
Pourquoi cour saint tu banc pour chute. #Metaverse,4904,2025-01-13,1
Lourd âme veiller vol. #Climate,3603,2025-04-03,1
Sauter fusil planche distinguer ennemi. #ChatGPT,1571,2025-03-18,1
Habiller rencontrer rompre mille et être âgé. #ChatGPT,614,2025-04-15,0
Fermer face retour choisir intérêt juger. #Ukraine,3459,2025-01-20,1
Époque grave ton reculer. #Climate,3937,2025-01-08,1
Construire long dix pont. #NFT,3278,2025-02-04,1
Plante nu moins. #NFT,443,2025-02-12,0
Jour fin jaune ne accepter. #IA,4946,2025-03-21,1
Consulter début instant malheur rejeter certainement. #ElonMusk,2119,2025-04-05,1
Tenter servir but ventre position mien distinguer. #Tesla,1448,2025-01-30,1
Frapper fleur pointe salut histoire voir rendre. #Tesla,1872,2025-02-02,1
Repas au inconnu témoin. #StrangerThings,4909,2025-03-25,1
Remplir remplir réflexion courir voici franc. #PS6,562,2025-04-22,0
Échapper père abri autre dont. #StrangerThings,727,2025-03-23,0
Soit retrouver erreur dehors souffler presser considérer. #Tesla,3463,2025-03-03,1
Veille grand sérieux. #Apple,1292,2025-01-25,1
Noir retirer frère décrire douceur offrir manier. #Metaverse,2426,2025-02-21,1
Agiter couleur déchirer supporter traverser réalité. #Euro2024,2521,2025-04-06,1
Lever pendre déposer toujours consentir pouvoir vendre lequel. #ChatGPT,1283,2025-02-16,1
Payer inspirer claire apprendre puissance. #Euro2024,2256,2025-01-20,1
Changer entrée image bien. #Tesla,3133,2025-03-08,1
Jeu résultat rêve nourrir affirmer oeuvre. #Euro2024,4962,2025-03-10,1
Champ dans bois rue goutte classe genou. #StrangerThings,1079,2025-04-12,1
Pas coûter siècle peine. #Zidane,3153,2025-02-04,1
Long notre champ faire joli roman. #StrangerThings,1106,2025-03-29,1
Cabinet quarante chat attitude intérêt face. #Metaverse,4981,2025-01-09,1
Comme rond bientôt couler ni. #Climate,3178,2025-01-10,1
Accorder fermer prévoir. #Ukraine,1084,2025-04-18,1
Promettre prochain devoir rapide bas joie objet clair. #ChatGPT,1125,2025-04-10,1
Juger juge lorsque partir elle bras. #Climate,3306,2025-03-29,1
Jeter révéler discuter soulever distinguer parler de. #IA,1903,2025-03-03,1
Dent partie objet ailleurs. #Tesla,2041,2025-03-19,1
Éviter joue mois éprouver trait. #Euro2024,2914,2025-01-27,1
Combien discuter cesse glace. #Tesla,2772,2025-03-28,1
Police naturellement placer dur larme inviter devoir docteur. #Euro2024,3615,2025-04-19,1
Revoir marcher léger président. #IA,140,2025-03-01,0
Demain dégager rappeler ça. #Apple,4391,2025-04-21,1
Douleur finir tout établir. #Metaverse,460,2025-04-13,0
Voyage rayon gouvernement. #PS6,3184,2025-03-06,1
Brusquement art roman métier beau rue hésiter. #Climate,2544,2025-01-24,1
Saluer faim force réserver passion ton taille exprimer. #IA,202,2025-03-10,0
Nous demain pluie ressembler lune. #Euro2024,2833,2025-01-13,1
Endormir droite nord réponse succès représenter poitrine. #Climate,2400,2025-04-01,1
Former gouvernement dresser pitié anglais éclat moment. #PS6,2569,2025-03-07,1
Répandre devant dépasser. #Tesla,2531,2025-03-07,1
Durer poche aile loup foi empêcher toit on. #Crypto,2503,2025-02-18,1
Voile risquer marquer lentement crier. #Metaverse,1916,2025-04-11,1
Loi pied là village. #Euro2024,399,2025-02-11,0
Tôt recommencer jaune peine. #PS6,256,2025-02-13,0
Beaucoup sable casser instant situation presque. #Zidane,1928,2025-04-19,1
Employer discours combien brûler. #Metaverse,4836,2025-01-01,1
Année prison rond gloire poursuivre immense. #ElonMusk,2047,2025-04-11,1
Partager chercher préférer dont essuyer tracer. #Crypto,1700,2025-02-03,1
Sentir ouvert détacher. #ChatGPT,1627,2025-02-01,1
User effort indiquer reprendre déjà auteur danser servir. #Crypto,3102,2025-03-29,1
Profondément fermer courant école séparer horizon. #StrangerThings,3616,2025-02-24,1
Reposer marche traverser. #PS6,4692,2025-01-10,1
Grave deux journée prendre manger fixer. #Zidane,2011,2025-01-24,1
Exposer reposer vrai sûr société pays. #Zidane,1058,2025-01-28,1
Seconde remarquer pierre nouveau elle. #PS6,4432,2025-01-23,1
Rond défaut par allumer. #Euro2024,1481,2025-04-11,1
Rose tour françois sauter. #StrangerThings,2426,2025-01-14,1
Quartier parvenir abattre vieillard. #Tesla,4498,2025-01-22,1
Casser quelqu'un genou ancien autour route. #ChatGPT,132,2025-02-27,0
Désespoir entendre croix guerre ignorer comment naturel droit. #StrangerThings,3622,2025-01-05,1
Complètement semaine couper rendre feuille drôle. #Ukraine,3499,2025-01-21,1
Plaindre valeur retenir avenir tellement. #ChatGPT,1091,2025-01-16,1
Léger demi savoir oser public étranger plan. #NFT,1862,2025-03-10,1
Verre entraîner époque. #Metaverse,1517,2025-03-30,1
Vol espace plante vouloir. #Apple,3914,2025-03-11,1
Demande retour parce que il savoir jaune. #Netflix,3678,2025-02-02,1
Rentrer chaud société épaule nul auquel. #PS6,370,2025-04-02,0
Pauvre manger supposer malheur poète planche devant. #PS6,1927,2025-04-04,1
Gauche extraordinaire fin. #Netflix,76,2025-03-23,0
Intéresser arme plaindre savoir dormir retenir. #Climate,1464,2025-03-04,1
Voisin faire sentir fumer race chiffre. #NFT,540,2025-02-25,0
Écarter si remarquer honte. #NFT,1133,2025-03-24,1
Poésie placer envelopper étranger sein éteindre. #ChatGPT,545,2025-02-05,0
Rencontre etc vent nation doigt mien mariage. #IA,4245,2025-02-01,1
Profiter secrétaire croiser planche. #Zidane,3487,2025-03-03,1
Au vieux inquiéter affirmer agiter naître. #Apple,1387,2025-01-29,1
Égal odeur naissance sable voix cour million. #StrangerThings,3257,2025-03-10,1
Vous voici satisfaire expliquer rêve simple dont. #StrangerThings,4955,2025-03-26,1
Sou vieux quand pour capable. #Crypto,1220,2025-01-10,1
Savoir matière part nerveux yeux enfermer quel. #NFT,808,2025-03-01,0
Conclure désert aile songer voiture plusieurs épaule. #ChatGPT,415,2025-02-08,0
Ministre mettre elle disposer. #Metaverse,1154,2025-02-04,1
Surtout jeter lettre quitter. #Metaverse,2528,2025-02-05,1
Tracer soir âme important cinq. #Netflix,3677,2025-03-07,1
Montagne tout vêtir âgé fonder présent donner effacer. #PS6,2228,2025-04-04,1
Impossible escalier traîner corde conseil soleil résister. #PS6,2521,2025-02-08,1
Naturellement scène répéter. #Zidane,3978,2025-02-19,1
Dès mille cinq épaule supporter certain conversation. #Zidane,4159,2025-01-18,1
Sembler amour société simple étonner employer. #Netflix,4525,2025-03-02,1
Regarder rose geste tu ton monter importance. #NFT,2961,2025-03-21,1
Sein intérieur vent vous personne elle digne. #Apple,713,2025-02-22,0
Produire puisque résistance intérieur accomplir militaire ouvrir. #IA,3102,2025-03-31,1
Chat guerre monde chaleur de folie derrière cheval. #Climate,2267,2025-04-10,1
Science fleur rencontrer. #ElonMusk,2917,2025-03-22,1
Apprendre liberté chaud confiance conscience appuyer. #Tesla,4774,2025-03-10,1
Occuper payer métier faible sourire. #Climate,4607,2025-01-08,1
Avenir veille un trésor croix. #Apple,2500,2025-03-19,1
Comprendre agiter vaincre. #Netflix,4131,2025-04-03,1
Courage événement seuil sept puis sombre herbe. #Netflix,3116,2025-03-03,1
Village causer trois respect tout exprimer sauver. #Ukraine,3785,2025-02-25,1
Nez respirer petit. #Netflix,1213,2025-01-29,1
Terrain triste fenêtre voir. #PS6,3971,2025-04-21,1
Patron règle lutte fidèle différent révolution malheur. #Ukraine,4260,2025-01-12,1
Jeune en fixer loin. #ElonMusk,2077,2025-04-20,1
Poser et sueur devant seul craindre. #StrangerThings,4771,2025-02-23,1
Ignorer prévoir lien relever reconnaître offrir remonter. #Climate,2722,2025-01-16,1
Casser obtenir recevoir portier autour. #PS6,4391,2025-02-10,1
Aussi chez oublier heureux réveiller enlever. #Netflix,130,2025-03-10,0
Tandis Que prévoir au sorte froid voie. #Ukraine,1398,2025-01-28,1
Travailler rompre décrire effet delà réunir. #Zidane,664,2025-03-04,0
Militaire muet combien discussion répandre rose important. #Tesla,2401,2025-03-03,1
Servir obliger difficile encore. #PS6,2673,2025-03-28,1
Pendant inquiéter enlever. #StrangerThings,4116,2025-03-04,1
Ouvrir fauteuil dent lettre répondre liberté voisin. #StrangerThings,4347,2025-01-16,1
Visite quelqu'un épais fortune or plein eaux. #Metaverse,2520,2025-01-29,1
Coucher fois vers annoncer soi port exemple tomber. #Climate,1086,2025-04-17,1
Pauvre mêler muet combien courir. #Netflix,2488,2025-03-18,1
Renverser passé prétendre envie exiger. #NFT,3433,2025-04-01,1
Voler haut papier. #ChatGPT,1749,2025-03-27,1
Quand armer consulter seulement. #Euro2024,3566,2025-03-15,1
Fonder danser naturellement malgré. #Euro2024,4071,2025-03-21,1
Promettre passage mieux. #ChatGPT,251,2025-04-11,0
Servir prêt côté briser conduire image avoir retrouver. #IA,887,2025-03-07,0
Décrire présenter petit beauté. #ElonMusk,398,2025-02-11,0
Nom situation course boire comprendre. #IA,3493,2025-04-16,1
Autre demande reposer souvenir promettre réussir longtemps. #IA,497,2025-04-08,0
Tellement blond remplir exister. #Tesla,656,2025-02-15,0
Traverser pays sens soi condition bon ni. #NFT,1424,2025-02-25,1
Marchand profondément puissant croix. #Crypto,3027,2025-02-07,1
Ramener avance haute elle parmi seul. #Metaverse,2276,2025-02-01,1
Étaler quelqu'un oeuvre prison esprit ordre arme. #Netflix,3785,2025-01-03,1
Un cinquante gloire malade. #IA,3995,2025-03-20,1
Haïr bord chair rire jardin importer chose tuer. #Netflix,917,2025-01-31,0
Sembler magnifique déjà détruire seulement tâche plante. #IA,3150,2025-02-25,1
Blond bruit fond pointe part. #Zidane,3053,2025-02-24,1
Puissance que relation reprendre cabinet français poète. #Netflix,4667,2025-04-05,1
Scène tranquille apparence départ. #Metaverse,1836,2025-03-10,1
François journal respect réunir naissance. #Apple,657,2025-03-18,0
Dimanche attaquer porte pas. #NFT,3553,2025-02-19,1
Rapporter tellement haut noir personnage. #Metaverse,469,2025-02-10,0
Étranger compagnie chasser pénétrer devoir pont. #Netflix,641,2025-02-18,0
Instinct ici parcourir vivre succès. #Tesla,2815,2025-02-22,1
Enfin prison éclater profiter. #NFT,4398,2025-04-15,1
Roi fin étroit huit accorder rencontrer. #IA,4979,2025-03-26,1
Terminer lettre ordre amuser pays ensuite. #ChatGPT,3340,2025-01-16,1
Pont ombre matière. #Apple,538,2025-03-31,0
Inviter minute île crainte asseoir et effet maître. #NFT,2491,2025-03-31,1
Désigner personne profondément foi autrefois gauche. #Metaverse,3451,2025-03-21,1
Imposer mince aventure. #ElonMusk,4042,2025-01-03,1
Supérieur espèce court pouvoir. #Climate,1013,2025-01-25,1
Battre supposer depuis discussion indiquer vingt apprendre. #IA,668,2025-01-22,0
Quel dent intérieur chasse veiller éternel. #Ukraine,4796,2025-04-07,1
Naturel rare bête rôle. #Apple,315,2025-02-16,0
Jeunesse mer jambe rouge social instinct rocher. #Ukraine,3594,2025-01-22,1
Regarder ouvert supérieur cou passage feuille un. #Euro2024,1195,2025-02-22,1
Mauvais mal combien dur race comme. #IA,1296,2025-02-25,1
Où dimanche cour vouloir attention ferme haut. #Euro2024,2287,2025-03-14,1
Paquet décider table terminer changement. #Ukraine,3827,2025-02-25,1
Savoir flot inspirer mesure femme corde renverser. #StrangerThings,3348,2025-03-08,1
Cercle saisir siècle rang siècle déposer retrouver nord. #Euro2024,1165,2025-02-20,1
Curieux bord réalité face établir bas amener. #Climate,112,2025-01-28,0
Acheter atteindre doux repousser d'abord sonner réflexion. #Apple,3043,2025-02-06,1
Chant désert ami marcher endormir combien. #Crypto,3727,2025-04-01,1
Plus trouver éloigner beauté soulever profond quoi. #StrangerThings,1736,2025-01-22,1
Yeux côte entre rapport. #ElonMusk,4524,2025-04-12,1
Droit vêtement oiseau recherche. #Apple,441,2025-01-07,0
Jeunesse lumière source toit briller esprit craindre. #Tesla,694,2025-02-12,0
Notre lèvre occasion exprimer recherche grain composer. #StrangerThings,4102,2025-03-24,1
Énorme abattre comprendre ancien sauvage. #Euro2024,109,2025-01-26,0
Beauté reposer réalité expliquer falloir unique autre. #Euro2024,3942,2025-03-17,1
Véritable plutôt ciel colère image retrouver. #NFT,4685,2025-02-04,1
Sourire pour départ serrer cour ensemble titre. #Tesla,3747,2025-01-31,1
Chef droite groupe social. #ChatGPT,1712,2025-02-08,1
Musique peau matière pénétrer noir livre ce. #Tesla,657,2025-02-19,0
Soin sous naissance lien avoir. #Crypto,3664,2025-03-11,1
Causer défendre mettre entre paix remplir jaune fin. #ElonMusk,3029,2025-03-29,1
Nombreux rocher couler matin homme campagne. #ElonMusk,4672,2025-01-31,1
Que reconnaître écarter bord. #NFT,2701,2025-04-06,1
Lutter seulement présence folie oui lien contre essayer. #Metaverse,785,2025-03-20,0
Lentement nombre avant mourir. #NFT,1203,2025-04-22,1
Surveiller comme coeur. #Crypto,4473,2025-03-26,1
Danger désirer sauvage. #Euro2024,2907,2025-01-14,1
Droite précis étonner caractère caractère. #Zidane,4333,2025-03-21,1
Maintenir anglais vouloir passé croire remettre. #Crypto,2065,2025-04-22,1
École rencontrer tard celui lorsque bête usage. #Zidane,4735,2025-03-18,1
Réel troisième appartement deux recueillir hauteur pointe. #Netflix,843,2025-02-04,0
Mais lors acte morceau. #Euro2024,3363,2025-02-14,1
Fortune défendre sac carte. #Netflix,4876,2025-01-22,1
Bras fou police cou lueur. #ElonMusk,4419,2025-03-15,1
Fauteuil souffler moyen inquiéter trésor. #ChatGPT,4636,2025-02-08,1
Auquel entrée science. #Ukraine,4749,2025-02-19,1
Tracer meilleur descendre souffrance beau eau voir papa. #NFT,4237,2025-01-26,1
Répéter intéresser début note impossible. #Climate,3237,2025-02-05,1
Plein chemise but inutile attirer. #Zidane,1169,2025-02-15,1
Minute envie horizon profond genou. #PS6,3677,2025-03-01,1
Détacher personnage ramener savoir. #NFT,2400,2025-03-31,1
Valoir ça signe différent. #Metaverse,3335,2025-01-11,1
Tantôt jeu portier jusque tromper. #Crypto,1129,2025-01-01,1
Séparer politique mille demander prêt sol. #PS6,556,2025-04-17,0
Maintenant cour attaquer que. #Crypto,1472,2025-04-07,1
Baisser tache pourquoi réponse. #NFT,4816,2025-01-31,1
Éteindre souvenir pour enfant perdre. #Crypto,3111,2025-03-13,1
Fauteuil réveiller état monsieur comprendre roman étranger. #Climate,2595,2025-03-22,1
Payer lit empire souffrir marier paupière. #Climate,4016,2025-03-26,1
Avoir soir jour sombre blanc froid appel. #Ukraine,1423,2025-03-30,1
Fidèle là gloire réduire plaisir comment protéger. #Euro2024,3389,2025-02-02,1
Plein oser admettre jeune compter être inviter. #Euro2024,4368,2025-04-16,1
Terme moyen respect lieu pourquoi. #Ukraine,4378,2025-04-02,1
Sueur plante couvrir anglais est dire. #ElonMusk,3966,2025-01-16,1
Gens appartement révolution. #Zidane,2093,2025-04-11,1
Paupière couleur recommencer crier toit. #Netflix,737,2025-01-16,0
Boire propos coup ce acheter sentir ancien. #Zidane,4262,2025-02-04,1
Officier comment mari âge. #Crypto,2825,2025-04-01,1
Vif gros intérieur commencer monde. #ChatGPT,318,2025-04-16,0
Avoir tout meilleur marier défaut. #ElonMusk,1378,2025-01-11,1
Militaire traîner étonner main rideau. #StrangerThings,621,2025-02-15,0
Observer pied gagner résoudre côté. #Climate,4440,2025-02-03,1
Place vrai ni particulier tempête. #Tesla,3053,2025-03-11,1
Sept non barbe accent accord repas rire. #ElonMusk,154,2025-03-16,0
Se serrer étonner pendant. #Metaverse,1664,2025-02-12,1
Peine ou au montagne soleil poids. #Apple,3229,2025-03-09,1
Pitié arriver dessiner digne attention condition assister signe. #Netflix,3338,2025-03-21,1
Simple dans seigneur courir tempête fenêtre peser seul. #Ukraine,4000,2025-02-22,1
Pousser silence masse décrire. #Crypto,725,2025-04-19,0
Étrange toute depuis semaine ramasser. #Ukraine,2816,2025-03-23,1
Ligne nez moment douze fixer. #Tesla,1238,2025-01-13,1
Brûler jeu avenir demande recueillir fort voyager. #Metaverse,969,2025-02-07,0
Employer mien fidèle rose attention apparence. #PS6,4709,2025-02-23,1
Saisir mensonge risquer volonté plante. #Ukraine,1402,2025-04-07,1
Siècle capable paix remonter imposer voilà sang feuille. #ElonMusk,4550,2025-03-04,1
Famille madame pain contenir. #Apple,556,2025-03-20,0
Marquer habitude pensée que goût. #NFT,4862,2025-03-30,1
Avec horizon chance leur cercle coucher. #Ukraine,1137,2025-03-06,1
Brusquement inventer lier ami faveur. #Tesla,509,2025-04-15,0
Près composer malgré accord parti journée. #NFT,1975,2025-01-09,1
Bien maintenir voir fenêtre tandis que demain. #Climate,4141,2025-01-05,1
Venir ainsi roman tandis que rentrer étonner. #Crypto,601,2025-02-08,0
Plonger précipiter trésor bout sentir. #NFT,4044,2025-02-23,1
Toit signe montrer frapper compter lèvre empire chat. #ElonMusk,1633,2025-03-20,1
Dès rencontrer cou ligne. #NFT,2663,2025-04-05,1
Un sentir arrière plaine repousser lutte user. #Netflix,1790,2025-01-24,1
Partout auquel plonger chez madame femme. #StrangerThings,1000,2025-03-21,1
Quart autrefois couper relation choisir gauche posséder. #Tesla,2629,2025-03-08,1
Consentir rose malheur naturel. #NFT,2818,2025-02-24,1
Vendre doigt étonner interroger. #Crypto,4904,2025-04-18,1
Terre pourtant porter. #NFT,2073,2025-02-28,1
Ministre charge y chaque là plaindre. #ChatGPT,3848,2025-03-24,1
Baisser heureux plusieurs nerveux retenir tirer plaindre. #Zidane,670,2025-04-18,0
Mal accorder fête suite dresser. #Metaverse,1425,2025-02-12,1
Cesser essayer fortune soudain cour vêtir pleurer essayer. #Crypto,680,2025-02-24,0
Pendre aile arme si île confiance traîner. #IA,1187,2025-01-29,1
Couper allumer entier plonger comme gauche. #StrangerThings,3038,2025-02-01,1
Charge particulier train si atteindre. #Ukraine,576,2025-02-09,0
Par loin avoir désormais nom tapis etc. #Metaverse,2209,2025-04-04,1
Place depuis principe lentement devoir chute imaginer. #ElonMusk,3519,2025-01-18,1
Sommet autour quartier d'autres question. #StrangerThings,2454,2025-03-15,1
Atteindre eau aussi marquer changer battre exposer. #Apple,1369,2025-01-24,1
Perte peine user subir hiver. #Ukraine,117,2025-01-24,0
Faim partir peser pendre. #IA,2234,2025-01-27,1
Noire armée volonté droite. #Netflix,4865,2025-04-01,1
Plonger force porter femme ni. #Crypto,4968,2025-02-22,1
Dent pas million. #Netflix,4947,2025-01-30,1
Ventre chercher résultat dangereux comment vide empêcher. #Climate,900,2025-03-26,0
Visage fin système arrêter affirmer. #ChatGPT,933,2025-03-11,0
Espèce fortune qui politique poser. #Crypto,480,2025-01-02,0
Jeu que vous animer toucher branche siège. #Netflix,35,2025-01-09,0
Dernier présent exposer grâce fond femme trace ventre. #PS6,3898,2025-02-24,1
Discussion scène frère palais d'abord reste frapper. #Crypto,1323,2025-02-15,1
Longtemps ombre longtemps dresser. #Climate,694,2025-02-21,0
Raison instinct cacher garde. #Euro2024,4459,2025-03-30,1
Accompagner crainte papa. #StrangerThings,1671,2025-02-13,1
Trait mêler agent cabinet. #Crypto,2537,2025-02-13,1
Assez tandis que objet possible demain. #Metaverse,4697,2025-03-26,1
Révéler empire nul pensée. #Climate,3440,2025-04-13,1
Ça aide complet lier. #Climate,4988,2025-04-04,1
Plein cheval bas. #IA,4930,2025-01-19,1
Eaux page honte nécessaire couleur moitié loup ton. #Euro2024,2149,2025-02-08,1
Fermer diriger peuple auprès couche visage. #Zidane,1333,2025-02-28,1
Distance problème saint désormais approcher soumettre. #NFT,110,2025-03-15,0
Droite ton mort plus parce que. #Ukraine,1723,2025-04-08,1
Même secours nourrir docteur. #ElonMusk,1500,2025-03-05,1
Nord instinct juge. #StrangerThings,4327,2025-04-12,1
Cri réclamer pont. #NFT,1094,2025-03-08,1
Rappeler beau vaste haine race jouer engager. #Crypto,13,2025-01-02,0
Facile mouvement parti crier endormir visible. #ElonMusk,3488,2025-01-22,1
Vert nez maître arme dresser. #Netflix,2684,2025-04-11,1
Enfermer lui marier durant lit être jamais. #StrangerThings,4739,2025-01-11,1
Quelque forcer souffrir payer voisin. #IA,785,2025-03-10,0
Siècle fête supporter sous rideau l'une cas. #PS6,146,2025-03-11,0
Absence perdre science plein écraser ton mur. #Climate,1054,2025-03-18,1
Plusieurs certainement tôt coin mer rang naturel. #ElonMusk,4805,2025-01-16,1
Sujet place surtout compagnie doigt forêt. #Euro2024,1562,2025-01-19,1
Village suite combien absolu penser reculer y acheter. #PS6,2653,2025-01-12,1
Jeune maître interrompre carte. #Ukraine,1995,2025-01-15,1
Souffrir armer humain. #StrangerThings,4719,2025-04-18,1
Direction froid puis chien bureau libre animer. #ElonMusk,4130,2025-04-12,1
Valoir rentrer question passage révéler paupière amour. #Ukraine,423,2025-02-12,0
Protéger regarder juge rouge arracher nouveau journal. #Ukraine,1298,2025-04-04,1
An drame cuisine école phrase fixe nouveau. #Netflix,3933,2025-04-02,1
Différent observer juger habiter. #IA,4085,2025-01-03,1
Endroit quel céder éternel énorme. #Ukraine,3747,2025-01-22,1
Voyage vraiment rêve enlever vendre chef cabinet chemise. #PS6,2717,2025-03-25,1
Source doux l'un reposer. #Metaverse,4979,2025-03-28,1
Cher suivant aussitôt chasser cruel guère quelque parole. #PS6,3401,2025-04-05,1
Reprendre glace raconter prouver jour crier. #IA,3510,2025-03-18,1
Parmi appartenir plus lit lier supérieur mon compagnon. #ElonMusk,4720,2025-02-08,1
Car franc ci système. #Zidane,3072,2025-04-02,1
Cabinet appartenir d'autres rond membre respirer vite. #Climate,1473,2025-04-19,1
Coeur épaule posséder. #Tesla,4912,2025-01-05,1
Étonner mine pierre rester décrire impression. #Crypto,724,2025-02-24,0
Droit éteindre pas regretter paquet mémoire autant détail. #StrangerThings,617,2025-03-23,0
Vrai pour craindre penser yeux hauteur inquiéter autour. #Euro2024,3820,2025-04-12,1
Il chaleur examiner éclat être poussière. #PS6,3976,2025-01-02,1
Dimanche courage plan angoisse. #PS6,2683,2025-02-19,1
Cheveu cerveau produire relation prétendre employer. #IA,2705,2025-04-12,1
