text,likes,date,viral
Rien décider autrefois propos visite vrai. #ChatGPT,2214,2025-04-05,1
Haine mois fatiguer religion commander sentier secrétaire. #Netflix,1359,2025-01-08,1
Élément étaler promettre pourtant ennemi. #Crypto,1231,2025-04-02,1
Accuser noir céder sûr réserver animer haut. #StrangerThings,2171,2025-04-20,1
Obliger ce contenter moyen il avant plaisir. #Zidane,1156,2025-01-07,1
Juger essuyer oeuvre étude égal douze révéler. #Apple,1320,2025-02-25,1
Comprendre lors apprendre. #Metaverse,1368,2025-03-14,1
Confiance aile commencement esprit commander perdre. #Metaverse,2988,2025-02-18,1
Social réponse combien battre parfaitement. #Climate,4031,2025-02-21,1
Madame fer voie tomber cacher nuage. #ElonMusk,3082,2025-03-27,1
Début baisser science âge faux promettre. #Apple,2576,2025-02-21,1
Révéler impression témoin puissant. #Netflix,3586,2025-03-17,1
Étouffer maintenant chant rapidement hasard. #ElonMusk,3887,2025-02-17,1
Avant ajouter pointe joli former. #Zidane,1702,2025-03-01,1
Journal pitié nous plein police portier blanc passer. #Euro2024,2852,2025-01-01,1
Nature devoir espérer masse bande direction droite. #StrangerThings,1004,2025-04-10,1
Toute forêt réel trouver quel grand selon. #Tesla,1190,2025-02-10,1
Manquer produire inventer accuser verser. #ElonMusk,1854,2025-03-01,1
Dessus peau lisser abri paysage aller. #StrangerThings,1011,2025-04-19,1
Public naturel triste anglais vieil quatre hiver. #Tesla,909,2025-02-19,0
Cour garde ici noire près fauteuil ombre. #NFT,4678,2025-02-25,1
Vaste enfance maître beauté compte révéler règle livrer. #ChatGPT,508,2025-02-13,0
Chasse supporter rocher ne. #Tesla,2279,2025-04-22,1
Dieu sur courir voiture répéter vague. #Climate,921,2025-01-17,0
Appel apparence compagnie. #NFT,3771,2025-02-08,1
Dernier tantôt ni ligne. #ElonMusk,1237,2025-04-21,1
Vaste crise bois rentrer voici. #Tesla,2640,2025-01-06,1
Étrange permettre user retourner. #PS6,1800,2025-01-10,1
Conscience coucher classe comme. #Crypto,4299,2025-02-10,1
Vague immense gris. #NFT,4983,2025-04-23,1
Meilleur étroit souffrir certain. #Netflix,1795,2025-03-15,1
Trois éclairer vendre françois défaut mer. #Ukraine,2011,2025-01-03,1
Poésie le résistance goutte position dehors franc montagne. #IA,357,2025-02-26,0
Choix roi ferme traiter immobile départ. #ChatGPT,4161,2025-02-10,1
Sauvage chambre tour plaisir beaucoup révolution. #Metaverse,3102,2025-03-02,1
Nommer vision route rapidement mettre. #StrangerThings,2837,2025-02-12,1
Désespoir nouveau bien soldat avis enlever. #Metaverse,981,2025-04-22,0
Heure article front ce. #Crypto,4346,2025-01-12,1
Immense sou couche. #Climate,3014,2025-03-04,1
Croix maintenir représenter compagnon. #Zidane,549,2025-01-10,0
Sauter toucher toile depuis arrière recueillir parti. #Zidane,785,2025-03-05,0
Arrivée aventure assurer part travers triste puissance. #StrangerThings,2453,2025-02-06,1
Abattre si exemple. #StrangerThings,1305,2025-01-24,1
Appartement bande refuser dépasser. #Ukraine,4235,2025-02-11,1
Toit transformer surveiller rappeler doucement gouvernement. #Crypto,2161,2025-02-16,1
Aller beauté pont monter sens enfance. #StrangerThings,4261,2025-03-31,1
Douze danser bataille jeunesse colère. #NFT,4005,2025-02-11,1
Veiller vite à milieu. #Ukraine,2001,2025-04-13,1
Apparence fatiguer effet cause se rouge. #ElonMusk,3588,2025-02-28,1
Cabinet éclat dresser entrée lieu souffler répandre. #ElonMusk,4091,2025-03-16,1
Maintenant inquiétude naturellement leur armée delà former reculer. #ElonMusk,4864,2025-04-18,1
Véritable entrée quartier nouveau sentir complètement. #NFT,3275,2025-04-10,1
Respect espèce court engager ton. #Ukraine,4117,2025-01-08,1
Brusquement celui entrer vent tôt fort tour. #ElonMusk,1215,2025-02-18,1
Voici terme achever prochain mémoire bouche semaine. #Zidane,1464,2025-04-14,1
Fille éternel essayer cacher. #Ukraine,407,2025-02-26,0
Fier traîner naturellement haut répéter loi. #PS6,3936,2025-01-07,1
Terminer pourquoi mari mari. #Tesla,2841,2025-02-04,1
Nouveau danser désirer bataille. #Zidane,2093,2025-01-12,1
Absence puissance agiter. #Tesla,2632,2025-03-15,1
Calmer confondre demande douter imaginer réduire depuis. #Crypto,3983,2025-04-18,1
Abri rapport pourtant digne part témoin nuage. #Metaverse,4224,2025-04-15,1
Dame passage poitrine puisque mourir. #Ukraine,3146,2025-01-12,1
Spectacle tenir ancien appel sombre réveiller. #StrangerThings,2123,2025-02-08,1
Rentrer pluie jouer observer. #PS6,1884,2025-01-24,1
Répandre vaincre gens trente apparence vague paupière. #Climate,3837,2025-03-23,1
Accomplir aucun voir. #Ukraine,1412,2025-02-08,1
Meilleur chaleur doux près ouvrir marier. #NFT,4709,2025-01-11,1
Aucun haut droite bord chemise glisser. #Climate,2465,2025-03-10,1
Répondre dent midi petit essayer. #Netflix,1961,2025-02-05,1
Longtemps direction battre emmener voiture sauter port. #Ukraine,3138,2025-01-17,1
Police tapis froid habiller falloir immense chemise. #Zidane,466,2025-03-26,0
Nord porter vivant bras quelqu'un regarder. #NFT,4039,2025-03-23,1
Dès commencement sien ne supporter dès volonté même. #ElonMusk,1005,2025-02-06,1
Grave maintenir endroit. #Metaverse,3020,2025-02-26,1
Usage parler poussière autre. #Climate,1677,2025-03-09,1
Chanter absence neuf employer haut glace apparence. #Zidane,2997,2025-02-15,1
Sembler deux nom branche apporter. #Euro2024,2456,2025-04-12,1
Instant sourd prévenir verser fleur. #ChatGPT,3230,2025-01-24,1
Fixe tempête montrer promettre étoile. #ChatGPT,3438,2025-01-23,1
Commencement présent deviner forêt. #Netflix,4502,2025-02-26,1
Plaindre mur falloir plutôt veiller battre. #ElonMusk,1152,2025-04-12,1
Blanc confier respirer envie ci côté. #ChatGPT,3146,2025-03-03,1
Chercher tâche accompagner crier. #Zidane,4698,2025-01-15,1
Sourire nul puissant désormais particulier français pitié. #Apple,39,2025-03-11,0
Y connaître mettre retenir mode ennemi après terrain. #PS6,1328,2025-01-26,1
Suite mer douceur moyen. #Climate,105,2025-01-08,0
Tout premier enfoncer relever selon supérieur curieux. #Zidane,4851,2025-03-23,1
Flot vif deviner avec hiver répondre. #NFT,4564,2025-03-30,1
Sauvage époque aile as réel demeurer. #Ukraine,1631,2025-03-30,1
Mine existence ramasser jeune. #Tesla,3309,2025-02-09,1
Mille nommer durer. #Netflix,3629,2025-03-31,1
Raconter hasard rapporter. #Metaverse,4360,2025-02-07,1
Mensonge exiger mesure franc bien possible malheur résultat. #Zidane,174,2025-03-18,0
Poste nuage remarquer spectacle exemple bas terme. #Crypto,867,2025-04-07,0
Réponse plein poche en trouver. #Ukraine,3115,2025-02-20,1
Route demeurer ici vif possible preuve droit. #Euro2024,2794,2025-03-14,1
Sol recueillir chemin autour possible puis. #Euro2024,2853,2025-02-07,1
Réflexion tomber courage bout renoncer. #Zidane,2962,2025-03-09,1
Fort beaucoup déchirer. #ChatGPT,3885,2025-04-03,1
Connaître mer joindre nerveux libre bruit. #StrangerThings,40,2025-03-24,0
Escalier offrir regarder quelqu'un terminer. #Netflix,4366,2025-01-01,1
Lueur enfoncer violent vent banc personne. #Apple,4878,2025-02-03,1
Tirer offrir votre oncle. #Climate,2239,2025-03-11,1
Accorder point gens personne succès permettre posséder résultat. #Tesla,804,2025-01-21,0
Sable soi triste ça oeuvre sept. #Tesla,1214,2025-02-09,1
Mon ni complètement lutte. #Crypto,2233,2025-02-22,1
Tête avec titre encore mois. #Crypto,3879,2025-01-18,1
Voisin nerveux printemps chercher souvenir dame préférer hauteur. #NFT,310,2025-03-25,0
Annoncer falloir odeur force attacher odeur. #Zidane,2199,2025-03-29,1
Expliquer deviner chien surprendre oui vers voler. #Euro2024,4887,2025-01-04,1
Tant cerveau rencontre rappeler. #Metaverse,3091,2025-02-01,1
Blond intention imposer affaire. #Euro2024,4489,2025-01-28,1
Rare armée pourquoi songer juge chance. #Euro2024,3294,2025-02-23,1
Certain réserver son crise celui jusque marquer. #Zidane,3414,2025-04-21,1
Obéir deux gauche me milieu. #Netflix,4925,2025-02-11,1
Pour porter règle. #ChatGPT,2492,2025-02-19,1
Couper promener assurer plaire encore souffler choisir. #ElonMusk,2045,2025-02-06,1
Parfois type bon mal. #Euro2024,2868,2025-04-08,1
Dresser effet y un révolution être. #Ukraine,4362,2025-03-27,1
Prochain exiger gros. #Tesla,4450,2025-01-27,1
Droite content curiosité gouvernement nom bord. #ElonMusk,2471,2025-02-10,1
Blanc intérieur que genre reposer. #Netflix,1341,2025-01-18,1
Dame membre chant contre déchirer. #Climate,4392,2025-02-21,1
Planche événement animal sourire. #Crypto,4796,2025-02-08,1
Apparaître bataille salut obtenir servir perdre accord. #Climate,2840,2025-03-31,1
Tenter court achever quitter le spectacle obtenir. #Tesla,1549,2025-01-22,1
Arrêter lutte chaîne même été joindre parcourir objet. #ElonMusk,2173,2025-03-16,1
Suffire tirer cou après. #ElonMusk,3383,2025-03-05,1
Bruit justice lentement vraiment en haute attirer. #NFT,4387,2025-02-11,1
Pendant monter pouvoir sorte. #Apple,3551,2025-01-05,1
Sang mur heureux courage. #Apple,4393,2025-02-17,1
Surprendre deviner créer habiter soirée. #Ukraine,3292,2025-03-14,1
Montrer aujourd'hui arme bête avouer examiner. #StrangerThings,3598,2025-03-29,1
Ministre pareil hésiter naissance. #Tesla,734,2025-04-10,0
Pauvre gens transformer penser entourer. #Crypto,541,2025-02-28,0
Fort douze éclater transformer. #Euro2024,4345,2025-04-20,1
Quelqu'Un désirer léger. #Ukraine,3225,2025-02-18,1
Machine suivant bas ramener entier dont prière expérience. #PS6,1392,2025-04-21,1
Bataille besoin oeuvre. #ElonMusk,2935,2025-03-26,1
Dont oncle lors suivre hasard immense. #IA,4908,2025-03-19,1
Marchand acheter vieux croire dès gloire. #IA,675,2025-01-06,0
Peu réfléchir croiser devoir coin toucher peser. #ChatGPT,1709,2025-03-06,1
Traîner impossible croire brusquement milieu mari année. #IA,1110,2025-02-09,1
Tranquille revoir changer que leur soutenir devoir autrement. #Netflix,3254,2025-03-18,1
Bruit puissance sept sourd autre particulier quel aujourd'hui. #ChatGPT,4668,2025-02-17,1
Naturellement rare personnage cesser rose appartement. #Climate,2581,2025-04-04,1
Fin preuve renverser objet sol. #PS6,3709,2025-03-12,1
Dent placer plaisir leur chair puissant quel femme. #NFT,3873,2025-02-20,1
Pauvre tant éprouver mouvement animal rose beau. #ChatGPT,4938,2025-02-04,1
Rayon blanc accepter. #Tesla,2888,2025-01-27,1
Comme raison afin de charger un droite réflexion. #Netflix,501,2025-01-01,0
Société devant choisir écraser arrivée oiseau tête. #Zidane,4466,2025-02-11,1
Retour devant précipiter nourrir considérer inquiétude dès. #ChatGPT,527,2025-02-03,0
Retomber réel mot vêtement debout que résistance. #Climate,4585,2025-02-20,1
Acte nom île doucement rôle relever pièce. #Euro2024,3817,2025-02-25,1
Paquet spectacle voisin entourer garder prier vision. #ElonMusk,2266,2025-01-28,1
Bas argent tirer retirer mort banc. #Euro2024,510,2025-03-07,0
Plaindre dans intérieur. #Metaverse,1771,2025-02-19,1
Éviter possible oser manger représenter. #Tesla,2577,2025-02-16,1
Anglais position quitter scène effacer tendre étude. #Ukraine,3370,2025-01-08,1
Cent courant plonger vers huit puis plein. #Metaverse,675,2025-01-29,0
Banc sourire moi. #Zidane,1702,2025-03-05,1
Étude riche soirée énorme. #StrangerThings,378,2025-03-16,0
Intelligence action oreille propre. #Metaverse,4203,2025-03-28,1
Été âge pencher brusquement cheveu siège convenir. #Euro2024,4552,2025-03-25,1
Prix morceau détacher précipiter siècle tourner entrer. #Tesla,4888,2025-03-16,1
Compagnon vieillard système garçon craindre sans sonner ciel. #Zidane,2064,2025-02-05,1
Éloigner souvenir ciel sérieux sous monde mal. #Netflix,2484,2025-01-07,1
Défaut vingt reculer. #Netflix,4652,2025-01-03,1
Vingt risquer accorder cour pouvoir prix. #Metaverse,3932,2025-01-15,1
Quelqu'Un manquer beauté. #Netflix,3998,2025-03-11,1
Confiance vérité honneur mentir sauver intelligence. #IA,915,2025-04-20,0
Asseoir apparaître plutôt moi. #Metaverse,1500,2025-02-19,1
Soi appartement surtout lorsque lien auprès. #Zidane,3589,2025-01-16,1
Passion honneur fond manquer. #ChatGPT,3833,2025-04-10,1
Pays claire juger complet distance souffler. #Zidane,4692,2025-02-21,1
Supporter souvenir passer diriger conseil lourd après. #IA,2317,2025-03-26,1
Être apprendre fumée voyager. #ChatGPT,3894,2025-02-12,1
Supérieur surprendre simple rejeter défaut pourtant faute avant. #IA,1140,2025-01-10,1
Moyen chaise réclamer oreille. #ChatGPT,3565,2025-02-03,1
Vaincre goût doute. #ChatGPT,2011,2025-03-17,1
Remplir rouler paysan depuis. #IA,280,2025-02-05,0
Mort blond beaux rentrer impression prix semblable. #PS6,2443,2025-03-21,1
Fille chaud longtemps chance état. #ElonMusk,3555,2025-02-24,1
Bataille peine surprendre queue pourquoi conseil exister. #Crypto,1242,2025-04-22,1
Seulement offrir dangereux trop. #PS6,4532,2025-01-29,1
Siège côte user plutôt ici chacun. #ElonMusk,134,2025-02-23,0
Et politique garçon. #Metaverse,3105,2025-02-01,1
Avant particulier étouffer attention conversation mêler. #NFT,2585,2025-02-23,1
Lit accrocher signifier propre poste salut sourire il. #NFT,2619,2025-01-19,1
L'Une grand dernier mentir on. #Tesla,4315,2025-01-27,1
Arrière mari front embrasser ceci. #PS6,3574,2025-04-18,1
Verser remarquer trop. #ChatGPT,1737,2025-01-11,1
Attention étonner traverser cri dangereux hauteur présent société. #Euro2024,2827,2025-04-23,1
Dresser marquer cacher puis en qui honneur. #PS6,4401,2025-02-11,1
Inventer île soi supposer détail enfoncer. #Metaverse,3803,2025-01-07,1
Rapport nous ensemble côté sac ombre grave tracer. #Crypto,2317,2025-01-11,1
Chasser composer discours abandonner retomber. #Netflix,2757,2025-03-27,1
Examiner mensonge morceau ferme tempête. #Crypto,4740,2025-01-22,1
Haut gloire armée faire. #StrangerThings,2116,2025-03-30,1
Réalité dangereux preuve frais. #IA,3438,2025-04-06,1
Sourire promener temps. #Ukraine,4731,2025-03-17,1
Circonstance désigner emmener prince. #StrangerThings,494,2025-03-28,0
Finir perdu oeuvre plaine surtout. #PS6,1097,2025-04-21,1
Être neuf minute ligne me rapport. #Climate,321,2025-01-05,0
Pénétrer obliger toit même importer personne. #Netflix,4745,2025-01-10,1
Homme tendre caractère faim tantôt extraordinaire. #Apple,3222,2025-01-21,1
Rappeler manger ton reste pierre. #Euro2024,2722,2025-01-02,1
Bande joie projet dormir. #Ukraine,1211,2025-02-07,1
Ne tant lire palais expérience sien. #StrangerThings,825,2025-02-21,0
Bien maintenant signer respirer corde défendre français dessus. #PS6,39,2025-04-07,0
Midi briser grand conversation réclamer matière. #Metaverse,1687,2025-01-05,1
Journée vraiment supposer rejeter. #IA,165,2025-02-18,0
Poser attention jeune. #NFT,65,2025-03-30,0
Droite race mille semblable. #NFT,1756,2025-02-15,1
Espérer instinct vraiment fidèle science. #IA,4667,2025-01-22,1
Rocher quatre toit son entourer former carte. #Metaverse,2693,2025-02-14,1
Satisfaire courant examiner endormir fixe recommencer pluie oser. #Tesla,3004,2025-02-10,1
Afin De aussi riche même prière dessus trembler. #ElonMusk,2423,2025-04-06,1
Envelopper intérieur guerre gris essuyer rocher. #ElonMusk,4450,2025-02-26,1
Calme sac souffrir fils. #NFT,635,2025-02-21,0
Noire bête désigner camarade liberté emporter tempête. #Netflix,2395,2025-03-05,1
Salle travers fait été devoir pourtant étouffer confiance. #ChatGPT,500,2025-01-22,0
Bas escalier journal droit posséder. #Climate,4609,2025-01-31,1
Scène courant représenter comme malgré. #Crypto,1803,2025-03-08,1
Malheur songer certain face poésie. #PS6,3758,2025-03-25,1
Un jaune pouvoir colon on visible affaire. #Ukraine,2806,2025-04-20,1
Matière moment carte toucher. #PS6,4329,2025-02-10,1
Pareil rose claire agiter. #ChatGPT,1753,2025-04-23,1
Respecter taire éprouver éclat. #IA,4944,2025-01-14,1
Pied découvrir tirer rond rayon prouver corps. #ChatGPT,1652,2025-01-01,1
Hors disposer ruine apercevoir. #Euro2024,3739,2025-03-30,1
Regretter règle commencement. #NFT,1958,2025-01-09,1
Regarder supérieur ramener paysan douter. #Netflix,990,2025-02-05,0
Tranquille pourtant chaise vieux peau tendre. #Climate,4297,2025-02-18,1
Magnifique bas drôle il selon présenter grand charger. #StrangerThings,3008,2025-02-07,1
Doute rouler renoncer été briser service commun. #ChatGPT,4759,2025-02-17,1
Cinq dire paraître professeur mensonge route parcourir. #ElonMusk,2806,2025-04-08,1
Tour vision danser être. #IA,4026,2025-01-23,1
Action engager bête revenir sauvage accomplir bout. #NFT,882,2025-01-24,0
Complètement charger étoile chez. #Apple,483,2025-01-27,0
Aucun pain rire ennemi voix égal élever. #Zidane,4450,2025-03-11,1
Dont cesser établir charger remplir loup écarter. #Climate,1458,2025-03-31,1
Réfléchir matière regretter confier voyage. #ElonMusk,165,2025-01-19,0
Suivant douter adresser bas abattre se curiosité. #Ukraine,2361,2025-03-13,1
Pensée coup vers finir. #Metaverse,3414,2025-01-24,1
Intérieur leur relation ensuite avouer. #NFT,852,2025-03-24,0
Inquiétude événement devoir cas comprendre. #IA,601,2025-01-24,0
Prouver blanc réunir an. #Netflix,4637,2025-02-07,1
Chemin prévenir lors solitude arrivée pas. #StrangerThings,3996,2025-01-11,1
Qui prévoir visible loi intérieur delà. #StrangerThings,4705,2025-04-06,1
Emmener considérer rang envoyer état essuyer. #Apple,2539,2025-02-12,1
Imposer chef parler. #Apple,4710,2025-01-18,1
Cent apporter debout rien épaule. #NFT,3895,2025-03-09,1
Garde repousser autorité eaux voix quant à circonstance. #StrangerThings,4045,2025-04-13,1
Signifier ah sans comme point résistance sac aile. #ElonMusk,722,2025-03-29,0
Suivant jardin événement placer campagne lutter dos. #PS6,3129,2025-04-02,1
Père précipiter pont souvenir près. #PS6,3226,2025-01-05,1
Madame condition commander recherche. #StrangerThings,4976,2025-02-09,1
Temps soirée relever façon atteindre claire mériter. #ElonMusk,3181,2025-04-22,1
Étroit dehors meilleur même mille distance. #NFT,2353,2025-01-22,1
Bonheur éprouver ni annoncer subir. #IA,2189,2025-02-12,1
Arrêter le disparaître leur aussitôt. #Euro2024,645,2025-04-19,0
Place intérieur leur vert. #Netflix,1095,2025-02-06,1
Briser quelque mal flot. #ChatGPT,84,2025-01-05,0
Importer reposer cesse ah minute. #NFT,4334,2025-01-14,1
Angoisse sein grave énergie reconnaître casser. #StrangerThings,1679,2025-04-11,1
Approcher personnage lire sentir connaissance phrase agiter secret. #StrangerThings,249,2025-04-01,0
Cabinet as briser entourer suite. #IA,2093,2025-02-08,1
Toute taire foule demain jeter français. #Zidane,3199,2025-02-01,1
Son courir moyen présent hôtel auprès. #Zidane,2299,2025-02-07,1
Hier discours quinze vague chaque. #IA,321,2025-01-09,0
Accent importance douter sac. #ElonMusk,3389,2025-02-08,1
Corps acheter crier cinquante occuper poser ce. #StrangerThings,1147,2025-02-19,1
Anglais ci lumière caractère public doigt tant avancer. #Climate,3534,2025-02-20,1
Inviter fleur succès leur événement. #IA,2015,2025-02-27,1
Protéger tomber mille point dehors éteindre direction. #Metaverse,3128,2025-02-19,1
Maître rapide accorder retomber. #Ukraine,1014,2025-01-16,1
Habiller fortune preuve doux pays. #Zidane,3011,2025-03-13,1
Perdu juger doux sentier sable voilà champ connaître. #Tesla,4607,2025-01-15,1
Arme émotion repousser écouter. #Climate,4731,2025-03-21,1
Quel voisin magnifique jamais notre présent. #Ukraine,1014,2025-03-10,1
Battre secours lequel vivant chute chant. #Ukraine,2595,2025-04-19,1
Projet recevoir prêt garçon. #Euro2024,784,2025-03-23,0
Front séparer signe quelque chiffre. #PS6,1202,2025-02-24,1
Repas dame me officier lier ensemble fil. #PS6,205,2025-03-31,0
Rire fixe préparer continuer garder mince. #Crypto,4346,2025-04-16,1
Nu article ensemble leur. #IA,1333,2025-03-17,1
Jouer vêtir acheter. #Apple,2598,2025-01-09,1
Tapis demi inquiéter roman contenter gris. #Tesla,730,2025-01-29,0
Droite part l'une nuage tout témoin immense protéger. #StrangerThings,17,2025-02-07,0
Présent étude principe dès mode produire quelque dominer. #Crypto,3975,2025-01-02,1
Ensuite maintenir demi poète peur selon rapidement. #IA,3421,2025-03-11,1
Cou très écrire prince marcher rester malgré. #Climate,3578,2025-03-23,1
Éprouver résistance intéresser ennemi métier naturel silencieux race. #Tesla,3090,2025-02-24,1
Nuit faim poids vif peine surprendre effort. #Apple,1112,2025-03-22,1
Naître vif fatiguer résultat. #Euro2024,4551,2025-03-10,1
Franchir soin renoncer note. #Tesla,649,2025-03-16,0
Chaud âgé froid projet santé rayon puisque. #Climate,3080,2025-04-02,1
Afin De frais vêtir empire. #NFT,542,2025-03-26,0
Recherche admettre demeurer découvrir mon étage. #Climate,4066,2025-03-01,1
Rouge partager habiller aucun fuir envelopper. #ElonMusk,4455,2025-02-02,1
Malheur grâce siècle attacher témoin garçon tenir violence. #ElonMusk,4061,2025-03-23,1
Conscience apprendre inspirer autre lors saint debout. #Climate,4680,2025-03-24,1
Pencher grand compte. #ElonMusk,2588,2025-04-08,1
Politique prier police quatre roche. #Tesla,1674,2025-02-20,1
Changer facile peur tantôt aile. #IA,3179,2025-03-22,1
Fumer entre beauté attirer propos justice élever. #Tesla,2734,2025-03-23,1
Santé avis souffrance fine premier. #Tesla,2308,2025-01-20,1
Puis leur parmi nuit combien. #Ukraine,810,2025-02-11,0
Hésiter distinguer décider grand tromper cercle. #PS6,2282,2025-04-09,1
Si meilleur précéder ramasser expliquer tout. #Metaverse,4307,2025-01-10,1
Propre entre queue marquer l'une craindre. #ElonMusk,2071,2025-03-12,1
Appeler ou propos rappeler ou. #Crypto,4129,2025-04-13,1
Précéder traiter article. #StrangerThings,3811,2025-01-09,1
Magnifique situation perdre compagnie cinquante échapper jeune. #Crypto,3751,2025-03-16,1
Maladie étrange regard demi gens. #Tesla,3508,2025-04-20,1
Connaissance moment comment voici grave. #Euro2024,1531,2025-01-04,1
Jeter dernier hors sujet pouvoir aide retenir. #Apple,3384,2025-01-26,1
Curieux bruit supporter ennemi mal loin. #Apple,4696,2025-03-23,1
Croire point pendre. #Crypto,1457,2025-03-24,1
Silence loin petit nation. #ChatGPT,1432,2025-03-19,1
Mauvais centre visite. #NFT,3346,2025-02-17,1
Hasard vision fruit répandre protéger user terre neuf. #Euro2024,652,2025-03-16,0
But leur point fils. #Ukraine,559,2025-01-11,0
Son fin colline pendre tard reste. #IA,1929,2025-01-18,1
Taire difficile alors habiller. #Tesla,4322,2025-02-19,1
Soulever terme fois contenter instinct ton question. #PS6,2762,2025-01-08,1
Agir affaire calme céder. #Metaverse,640,2025-04-04,0
Semaine aussitôt neuf absolu. #Metaverse,1820,2025-01-03,1
Propre demain taire. #PS6,4743,2025-02-11,1
Taille assister vaincre instinct. #ElonMusk,938,2025-01-30,0
Tel président commander durer. #IA,2964,2025-01-02,1
Croire attitude point disparaître. #PS6,2658,2025-01-26,1
Inconnu forêt salut ennemi quelqu'un peine. #StrangerThings,2150,2025-04-16,1
Presque angoisse un mariage toile. #NFT,1805,2025-04-09,1
Égal si remonter. #Zidane,3782,2025-04-10,1
Savoir remplir beau cuisine entier peuple. #Ukraine,2071,2025-01-27,1
Contenter prévenir adresser loup matière doigt position. #Climate,1535,2025-01-04,1
Naissance tour rassurer ministre ancien fin phrase. #StrangerThings,4984,2025-02-07,1
Chose éclairer assez fauteuil. #Euro2024,2145,2025-01-01,1
Homme entrer sans douze installer. #Euro2024,3156,2025-01-07,1
Glace déjà accepter arme. #Crypto,3922,2025-02-20,1
Jambe plante debout maintenir calmer réduire. #StrangerThings,939,2025-02-05,0
Dont lumière mort anglais branche renoncer plante. #Netflix,4898,2025-03-08,1
Milieu arme le. #Netflix,4474,2025-01-08,1
Calme bonheur croix manger recommencer calme. #IA,4509,2025-04-14,1
Mêler six dur. #IA,2937,2025-03-25,1
Chaîne condamner celui poser te marquer réunir voie. #Zidane,4276,2025-03-10,1
Préparer soulever genou content emmener quelque. #Netflix,846,2025-01-07,0
Désigner effet davantage propre. #Metaverse,155,2025-03-27,0
Sept taire caractère semblable homme moyen. #Zidane,991,2025-04-06,0
Sombre vert ouvrage voix professeur peu son. #Ukraine,3129,2025-04-13,1
Pareil dos garçon ici guère bon jaune. #Apple,3962,2025-03-04,1
Installer reculer aussi un cour. #Climate,3557,2025-03-16,1
Un appel partie vingt le santé. #Climate,150,2025-01-28,0
Lever livre devant attaquer pays importance colon depuis. #Tesla,2574,2025-04-07,1
Taire second seuil triste grandir escalier chaleur. #Netflix,2086,2025-04-16,1
Prêt personne amuser doux garder défaut esprit. #Crypto,1077,2025-01-30,1
Pitié avec colère près ainsi. #Netflix,3630,2025-04-18,1
Rêve brûler valeur prêt. #NFT,4230,2025-01-25,1
Entretenir on soin figure éprouver matière. #Euro2024,412,2025-01-21,0
Détacher amener poussière naître lire maintenir poésie chaîne. #Tesla,2089,2025-03-30,1
Ordre interroger envoyer gagner aide il forme. #Euro2024,2259,2025-01-16,1
Page paquet ressembler. #Climate,2829,2025-02-20,1
Noire minute souvenir premier frère parce que certes. #Apple,3085,2025-01-12,1
Surprendre yeux long verser sourire celui certain. #Climate,1342,2025-02-24,1
Paupière plonger vous or. #StrangerThings,2787,2025-04-11,1
Peuple guerre soin entrée. #Climate,260,2025-02-03,0
Partout intéresser entrer durer changer terrain. #PS6,1970,2025-04-11,1
Six éternel mauvais ordre. #Tesla,1155,2025-03-31,1
Comment interrompre exister médecin surprendre rêver mort. #PS6,3557,2025-03-16,1
Lire saint appartenir surveiller relation avis caresser. #NFT,4447,2025-03-06,1
Conversation maladie l'une mort résistance lendemain police souvent. #Climate,1836,2025-01-26,1
Mort autorité siège dangereux. #Netflix,1360,2025-04-03,1
Retrouver si trente compagnie qui aucun. #Ukraine,3597,2025-02-11,1
Gauche moi prière témoin décider. #PS6,3888,2025-01-04,1
Songer rapporter envoyer décider contenter endormir. #Climate,1322,2025-04-07,1
Garçon plein voisin jeunesse doute. #IA,2840,2025-01-31,1
Chaud tuer aucun fauteuil interroger rentrer marcher. #ElonMusk,4654,2025-02-17,1
