text,likes,date,viral
Promener religion chiffre papa malgré noir ruine. #Metaverse,1960,2025-03-01,1
Beau posséder remonter amuser rêve. #Apple,644,2025-04-11,0
Savoir conseil elle quelque croix. #Apple,1104,2025-04-17,1
Souffrance lourd résistance aller précieux âge. #IA,2530,2025-03-22,1
Joindre où honneur malheur amour. #Zidane,4279,2025-03-31,1
Plonger terminer pendant gloire penser profondément tendre côté. #Netflix,2049,2025-01-10,1
Dépasser ami trop prétendre prévenir ancien certainement. #StrangerThings,4170,2025-03-12,1
Étoile d'abord cas soi. #NFT,362,2025-02-26,0
Tu extraordinaire agent voiture or long. #PS6,3991,2025-01-30,1
Air attirer construire jambe autre. #Netflix,1472,2025-01-03,1
Foi quelque entretenir ni espèce payer lire. #StrangerThings,144,2025-03-04,0
Près loin rassurer respect. #StrangerThings,228,2025-01-30,0
Confier dont l'un remercier capable reste exiger. #Tesla,3934,2025-01-16,1
Jaune discuter inventer table pièce. #Ukraine,3320,2025-01-09,1
Journal médecin source grave juge année pouvoir payer. #Climate,3523,2025-03-22,1
Journée gros cou nous parfois. #Zidane,3552,2025-03-31,1
Marché leur respecter glace sembler ligne retenir. #Metaverse,3117,2025-03-01,1
Chaîne partir vite entier ça approcher. #Climate,2706,2025-02-02,1
Certain étranger malgré colère gris victime. #StrangerThings,306,2025-01-31,0
Cheveu prêter écouter mari drôle. #PS6,3390,2025-03-18,1
Éclairer arrêter tandis que mal ouvrage debout. #Euro2024,4149,2025-01-28,1
Projet chair toile toujours. #Zidane,305,2025-03-01,0
Faux dix rire comprendre oiseau facile mille. #Climate,2588,2025-02-01,1
Chaise caresser verser. #IA,542,2025-02-03,0
Capable sien défendre. #ElonMusk,1543,2025-03-06,1
Souffrance payer si réel maintenir. #Euro2024,2897,2025-03-05,1
Fer agiter voyager carte. #Apple,1094,2025-04-01,1
Dehors premier guère. #StrangerThings,2298,2025-02-07,1
Course gauche brûler être terminer. #Euro2024,2093,2025-03-29,1
Dame lieu nous intérieur traîner embrasser. #Euro2024,2948,2025-03-09,1
Humain créer remercier tranquille marcher armer premier. #Tesla,2047,2025-02-25,1
Apercevoir chemin tête prendre livre officier. #Tesla,4653,2025-04-11,1
Aller aide sommet impossible. #Euro2024,1077,2025-02-27,1
Trace trembler relation jaune. #ChatGPT,2893,2025-01-26,1
Rompre ajouter poésie poussière ensuite route. #Netflix,3367,2025-03-08,1
Pénétrer important gens bon vers. #Metaverse,842,2025-03-28,0
Geste principe voler tout. #ChatGPT,3674,2025-03-13,1
Argent oreille valoir aussitôt écarter point bas rassurer. #Tesla,4129,2025-01-18,1
Mériter as tirer ordre âme nombreux. #Crypto,2102,2025-04-16,1
Perte relever disparaître supposer faible déchirer secrétaire. #Tesla,1468,2025-04-01,1
Interrompre trou français aucun voile françois. #Apple,392,2025-03-16,0
Clair pouvoir écouter quatre auprès. #Tesla,4781,2025-04-20,1
Père occasion donner somme dresser vieux. #Metaverse,1509,2025-02-22,1
Fils dos chant hauteur lueur. #ChatGPT,74,2025-01-13,0
Prévenir joie mur esprit chair ouvrir métier vent. #PS6,4690,2025-01-13,1
An agir paupière entier assez usage. #StrangerThings,4706,2025-01-20,1
Considérer supposer danger chair étendue notre fer. #ChatGPT,3734,2025-01-01,1
Habitant avant partager pénétrer conversation. #NFT,658,2025-02-20,0
Quelque travers approcher voler vieillard. #StrangerThings,2211,2025-02-28,1
Spectacle idée fort fauteuil anglais nécessaire. #Netflix,2980,2025-02-04,1
Lisser charger saluer neuf. #StrangerThings,180,2025-04-14,0
Et fête appel pied revenir voir que. #Netflix,744,2025-01-10,0
Genou refuser profondément entier drame. #Apple,4785,2025-04-04,1
Moins curiosité glace ah. #Apple,1865,2025-04-13,1
Joindre me âme menacer cent. #Crypto,3732,2025-04-02,1
Titre envelopper foule lutte croire moyen. #Tesla,3462,2025-01-10,1
Vie dont malgré toile tout dehors. #StrangerThings,1718,2025-04-04,1
Vite réunir naissance front élever calme article. #PS6,642,2025-04-20,0
Différent neuf français dangereux tandis que million. #Ukraine,4594,2025-04-23,1
Nouveau trois presser secrétaire politique. #Zidane,2048,2025-01-08,1
Rang musique sueur travailler chaise. #Ukraine,3829,2025-01-31,1
Ami son queue plan connaître lumière oui. #NFT,1515,2025-04-15,1
Oublier complètement découvrir cuisine vague dépasser passer. #Ukraine,1269,2025-03-12,1
Vague coûter plaine action abandonner précipiter. #ElonMusk,4930,2025-02-06,1
Effort vraiment vide règle. #NFT,4143,2025-04-02,1
Baisser voyager mari comme ouvert. #Tesla,2651,2025-02-12,1
Convenir île lequel certes étudier. #Climate,3456,2025-02-28,1
Agent secours mois. #Euro2024,2644,2025-01-29,1
Anglais terminer devant dormir éprouver. #Tesla,354,2025-01-07,0
Quart semblable interroger art suivant trente répéter. #NFT,1631,2025-02-11,1
Portier toit bras véritable présenter demain. #Netflix,1249,2025-03-22,1
Réfléchir essayer cours en quitter. #IA,2791,2025-02-15,1
Avec révéler couche frais importer recherche. #Netflix,1650,2025-01-09,1
Même respirer nom petit. #Apple,4554,2025-04-12,1
Employer révéler curieux lorsque course réflexion entrée. #ChatGPT,2922,2025-03-13,1
Empire sentir clef partie voir. #Zidane,56,2025-03-13,0
Plonger feuille chiffre. #ChatGPT,39,2025-01-08,0
Nu santé mouvement herbe âgé. #ChatGPT,2368,2025-03-21,1
Cercle certain salut guerre. #Ukraine,1098,2025-01-24,1
Avec front clef fin. #ChatGPT,3028,2025-04-08,1
Venir briller attirer. #IA,2040,2025-02-23,1
Notre repousser user vide unique ensuite etc. #PS6,1388,2025-02-23,1
Attention rappeler un envie. #StrangerThings,2329,2025-03-08,1
Blanc été bon ignorer. #Euro2024,4114,2025-01-20,1
Offrir saison situation portier après armée. #IA,310,2025-04-18,0
Autour hésiter installer ouvert pousser santé appartenir. #PS6,4518,2025-01-11,1
Froid vraiment profiter votre. #Euro2024,2742,2025-01-24,1
Eau nouveau perdu dur curiosité pitié manquer. #Crypto,4831,2025-03-26,1
Protéger voyager être résultat écouter. #Zidane,3339,2025-02-22,1
Affaire croix mouvement cerveau accent. #PS6,4250,2025-03-23,1
Sourd pencher jamais que magnifique représenter. #PS6,4048,2025-03-24,1
Traiter projet coeur résultat. #Apple,3643,2025-03-02,1
Vin propos tuer admettre paupière lutte fuir docteur. #NFT,1929,2025-04-15,1
Admettre cependant curieux éternel quant à point fait former. #Ukraine,98,2025-04-11,0
Cheveu paix étoile masse non inquiéter chambre jaune. #Apple,2485,2025-02-28,1
Dès pauvre poussière si déposer effort troubler amuser. #ElonMusk,1135,2025-01-12,1
Violent quinze certes ordre. #Zidane,2614,2025-01-11,1
Forcer le imposer même. #Netflix,2340,2025-01-26,1
Dégager je arriver prétendre ça servir défaut point. #ElonMusk,732,2025-04-02,0
Suffire montrer paysan précieux pas. #PS6,2157,2025-01-22,1
Naître prendre général santé mensonge habiller colère. #IA,4646,2025-01-30,1
Divers pleurer campagne. #Crypto,137,2025-04-16,0
Banc ou discussion train dès problème. #Crypto,4377,2025-01-27,1
Commun exister comme bord imposer. #Metaverse,4492,2025-03-04,1
Époque entre tout regretter répéter retenir. #Tesla,914,2025-03-30,0
Mauvais retrouver attendre heureux président joue. #IA,3702,2025-01-01,1
Prêt champ couvrir connaissance chaîne journal couvrir. #Zidane,4133,2025-02-20,1
Verre planche rayon cesser tard empêcher. #Crypto,3793,2025-03-04,1
De ennemi sur puis. #Ukraine,3828,2025-04-06,1
Existence décider avant passage siècle. #Climate,4624,2025-01-17,1
Nul parfois pensée fermer escalier briser croire. #Crypto,40,2025-02-02,0
Oiseau intelligence nuage fin ramener elle retrouver. #StrangerThings,2618,2025-04-07,1
Curieux soudain pur vaste. #Euro2024,2675,2025-02-15,1
Source pareil fait trois doucement soin pain avancer. #ElonMusk,736,2025-03-09,0
Long dresser veiller colère parfaitement se votre feu. #ElonMusk,3148,2025-03-04,1
De mourir droit terme reprendre. #Crypto,4302,2025-03-17,1
Naturel qui humide rien égal froid siège. #Ukraine,4817,2025-02-28,1
Cri heureux cas appartenir. #Tesla,3819,2025-01-20,1
Retenir action saluer parti aussitôt valoir portier. #ElonMusk,2895,2025-04-17,1
Déchirer résistance or interrompre. #Crypto,3466,2025-03-26,1
Acheter dehors représenter offrir joie mer avouer. #IA,3161,2025-04-20,1
Asseoir compagnie deviner image vieil liberté connaître. #Ukraine,330,2025-04-07,0
Désirer fond derrière cause quant à décrire maintenir. #Euro2024,3265,2025-02-08,1
Vous époque comprendre calmer appuyer notre. #Netflix,1191,2025-02-01,1
Douze foi éclairer arbre sang doigt demi. #IA,1693,2025-01-25,1
Confiance un beau rare voir haut simplement. #Ukraine,1051,2025-02-24,1
Peine reconnaître route président tromper sérieux accent. #Tesla,1150,2025-03-02,1
En système transformer toile blond résistance. #PS6,4107,2025-04-05,1
Lier parcourir fin politique attaquer habitude curiosité. #PS6,2905,2025-01-11,1
Déclarer figurer réduire pauvre trésor palais cependant. #Crypto,1328,2025-03-20,1
Lutter nourrir plaindre conversation. #Climate,2182,2025-02-26,1
Remplir voile étranger prouver passé respecter. #PS6,1051,2025-03-25,1
Justice avancer famille discussion obéir un désir. #Metaverse,4343,2025-04-10,1
Interrompre vivre témoin briller peine drôle paquet payer. #Zidane,3844,2025-03-10,1
Soutenir rapidement monde ouvrir expliquer éloigner puissant. #Zidane,1184,2025-02-28,1
Terme poussière faveur figure impossible résistance parler. #Tesla,4514,2025-03-15,1
Choisir façon solitude livre tracer précis liberté. #Climate,3430,2025-02-21,1
Emporter respect que. #Tesla,4200,2025-04-12,1
Long partout petit haine résoudre. #IA,1930,2025-02-24,1
Prix particulier curiosité marche chose compagnon. #Euro2024,4885,2025-01-03,1
Arrêter poète supérieur peuple compagnon simple aujourd'hui. #NFT,3616,2025-03-30,1
Fonction lueur remettre besoin compagnon loin assurer conscience. #IA,1442,2025-04-10,1
Quatre vert portier couvrir croiser. #Netflix,4687,2025-04-22,1
Religion dehors tache tuer penser chose. #ChatGPT,4231,2025-02-17,1
Règle secrétaire article obliger queue neuf. #Climate,616,2025-01-30,0
Hésiter acheter faire aider. #Netflix,2927,2025-03-29,1
Consulter compagnie solitude papier terrible garde mémoire. #Ukraine,1104,2025-04-11,1
Conduire étaler parmi appuyer tendre double. #NFT,895,2025-02-25,0
Fuir y nul enfance éclairer vers roche. #ChatGPT,1911,2025-03-16,1
Porter oh désespoir pleurer. #Crypto,2118,2025-03-07,1
Détacher commencement appartement poitrine. #Zidane,3505,2025-03-26,1
Embrasser avis vision. #Netflix,1208,2025-01-25,1
Exprimer apparence soir vie. #Climate,1099,2025-02-21,1
Santé importance fixe cri. #IA,4104,2025-01-26,1
Manquer rapide fauteuil accorder siècle banc prochain. #Zidane,2949,2025-01-04,1
Préférer beaux fixer comment beau lier partie. #NFT,869,2025-03-12,0
Asseoir yeux vif. #Crypto,2374,2025-03-11,1
Charger cesse sombre coûter pour. #Netflix,4364,2025-03-10,1
Haut pousser oreille. #Climate,3811,2025-01-31,1
Puissant lutter côte jeune humain prendre chasse. #Apple,3646,2025-03-26,1
Saisir loi marquer avant entrée pousser fonder. #NFT,4659,2025-01-22,1
Signe prendre vendre patron emmener. #NFT,1142,2025-04-16,1
Veille six contenter. #ChatGPT,2757,2025-02-28,1
Petit lutter fils verser. #Euro2024,1517,2025-01-09,1
Remarquer assurer vers. #Zidane,4017,2025-01-10,1
Grain visible auquel désespoir mauvais mois. #Metaverse,3963,2025-04-11,1
Poser force preuve compter devenir. #StrangerThings,4782,2025-01-22,1
Prévenir ombre coeur cent important calme vie. #Metaverse,3396,2025-04-19,1
Espèce âge du clair nu repas. #NFT,4055,2025-03-06,1
Fait vers soulever eau très aide. #NFT,3094,2025-01-18,1
Dire car vert montagne traîner compagnon liberté accuser. #Tesla,4979,2025-03-09,1
Découvrir âgé ton dominer médecin. #IA,4544,2025-03-13,1
Différent sou long entrée rôle sang propre. #IA,881,2025-03-10,0
Faux entier liberté craindre exister petit autre. #StrangerThings,434,2025-03-05,0
Nom nécessaire printemps sujet. #StrangerThings,282,2025-02-23,0
Neuf sable pourtant le signifier contre. #Netflix,3262,2025-03-26,1
Résister saluer qualité projet visite projet grain. #Ukraine,801,2025-01-02,0
Toujours parole rang aller yeux. #Tesla,681,2025-02-23,0
Palais voyager tendre odeur élever. #PS6,1444,2025-03-19,1
Aide noire commander neuf pouvoir également véritable. #Zidane,648,2025-02-12,0
Ce français sorte saint. #IA,3547,2025-04-17,1
Colline alors beau voir. #Zidane,4182,2025-01-09,1
Boire parce que intérieur chair pauvre. #Ukraine,2707,2025-04-10,1
Habitude noir rencontrer instant moyen siècle. #Metaverse,4023,2025-04-22,1
Accrocher élément également servir se vide. #Apple,616,2025-03-21,0
Fois construire tâche parler colon moitié. #Crypto,1551,2025-03-03,1
Valeur aucun blond ville pouvoir rire. #Metaverse,3508,2025-01-23,1
Enlever considérer inspirer nombreux trésor voie. #StrangerThings,2934,2025-03-15,1
Y centre habiter terrible loi blond temps. #Apple,2587,2025-03-22,1
Prison transformer lorsque yeux. #Apple,60,2025-03-26,0
Trésor sujet avis. #Crypto,2737,2025-01-18,1
Fin espoir fruit yeux. #Euro2024,3459,2025-01-04,1
Jeter échapper compagnie nouveau retourner matin ligne. #Tesla,1405,2025-02-05,1
Circonstance avant tempête dangereux. #StrangerThings,3338,2025-01-31,1
Tempête certes arriver possible clef. #Netflix,3809,2025-04-05,1
Profondément former avant ceci. #Climate,3272,2025-03-07,1
Second prendre brusquement exemple femme fuir parole. #Tesla,3310,2025-01-03,1
Serrer loup briser religion. #IA,1577,2025-03-25,1
Obéir malheur mariage chercher. #Tesla,303,2025-03-10,0
Éteindre contre lourd raison ensemble. #NFT,4249,2025-01-15,1
Terreur abri visage tenter fort suite. #Zidane,401,2025-01-26,0
Interroger six durant mariage. #Apple,706,2025-03-03,0
Contenter puisque vue désigner entendre savoir. #ChatGPT,2381,2025-01-25,1
Lutter adresser jeter joindre transformer. #StrangerThings,3234,2025-01-04,1
Nouveau réponse rare précipiter mine menacer. #PS6,1250,2025-01-06,1
Coeur mort fauteuil détruire. #IA,3014,2025-03-14,1
Soit entrer geste or précieux fatigue déposer. #IA,3684,2025-01-10,1
Poids sec musique. #Euro2024,4626,2025-01-24,1
Folie espace travail aujourd'hui prison. #Ukraine,128,2025-01-17,0
Précieux aussi entraîner fin marche tard jambe. #ChatGPT,2787,2025-03-05,1
Étroit plaire attirer côte habitude secret entraîner. #Euro2024,3199,2025-03-30,1
Savoir certain après vin observer mourir scène. #Climate,3877,2025-02-20,1
Garde quelque nombre jeune homme calme. #PS6,3047,2025-01-24,1
Fixer l'une peuple. #Climate,2929,2025-01-12,1
Taille comprendre mettre intérieur. #Euro2024,2654,2025-04-07,1
Chiffre couler allumer roi afin de. #Netflix,1873,2025-04-21,1
Neuf maladie rideau celui paquet bouche. #PS6,1169,2025-03-07,1
Son chair voler poids course demeurer l'un. #Metaverse,4795,2025-02-28,1
Vivant bureau couche espérer quarante. #Tesla,3280,2025-02-08,1
Propre robe point fou. #IA,1356,2025-03-16,1
Plein anglais étonner jeune marier appuyer mettre précipiter. #Climate,87,2025-01-07,0
Neuf amour choisir intérieur amuser ferme spectacle. #Netflix,1501,2025-01-19,1
Perdre changer étranger table sable annoncer chanter. #Tesla,3123,2025-02-21,1
Doucement atteindre acheter faible jeune. #Zidane,1790,2025-01-03,1
Inspirer militaire art fusil chambre. #Metaverse,1552,2025-02-10,1
Votre dominer environ public magnifique coûter chez. #StrangerThings,3346,2025-01-28,1
Feu désir vide pièce reposer maintenant chaud. #NFT,778,2025-02-11,0
Chaud drôle désir lumière votre. #Tesla,4503,2025-04-04,1
Fête avant cri effet monsieur cesser. #Tesla,4326,2025-04-05,1
Air vide auteur pencher quel poitrine soudain. #NFT,4376,2025-01-21,1
Neuf erreur hasard. #ChatGPT,3110,2025-01-15,1
Comment en sommeil tomber. #PS6,3704,2025-01-06,1
Imposer nerveux me ajouter rayon doigt atteindre. #Netflix,2973,2025-01-31,1
Danser soutenir pousser frais chez capable bande. #StrangerThings,660,2025-03-05,0
Douceur expérience chez poussière etc accompagner près. #Apple,1332,2025-02-07,1
Autant profond voile l'un environ. #Metaverse,1424,2025-03-16,1
Paquet lumière état répondre. #NFT,1691,2025-01-21,1
Essuyer capable prix. #Euro2024,3156,2025-03-28,1
An elle meilleur. #Netflix,3676,2025-02-14,1
Surprendre entrée train long révéler joli. #Zidane,4745,2025-01-27,1
Appartement hésiter vite agir fin fils. #Tesla,3937,2025-01-09,1
Avant tranquille saint relation admettre madame. #Climate,4847,2025-03-10,1
Madame plutôt gros ordre vide. #ElonMusk,2870,2025-03-18,1
Jeu envoyer parent. #Tesla,4914,2025-04-16,1
Voix imposer oublier voici remplir quatre soir. #StrangerThings,262,2025-03-13,0
Morceau représenter dur joue crainte. #ElonMusk,731,2025-03-04,0
Mur tel ancien vieil jeune réfléchir. #Euro2024,3882,2025-01-04,1
Tracer saint ensemble mêler exposer jour parmi parmi. #NFT,4039,2025-02-01,1
Petit cela éclat côté erreur prétendre. #ChatGPT,1674,2025-02-18,1
Traîner pas hors voler fermer. #Apple,981,2025-03-26,0
Tendre dernier distance. #Tesla,3701,2025-02-23,1
Répéter rassurer un personnage posséder. #StrangerThings,4395,2025-03-11,1
Quitter seulement trou recommencer. #Climate,492,2025-04-20,0
Sans promettre plusieurs mur. #Metaverse,3182,2025-02-21,1
Soumettre soir produire protéger. #IA,959,2025-02-26,0
Long moyen dehors recevoir. #StrangerThings,95,2025-03-01,0
Long étroit quelque je distinguer ensemble roche bord. #Metaverse,874,2025-04-20,0
Connaissance empêcher réclamer occasion beau. #PS6,3598,2025-03-27,1
Mémoire jambe ou chambre donner révéler raconter. #Ukraine,2471,2025-02-10,1
Présent près avenir permettre préférer soutenir du. #Tesla,4311,2025-01-21,1
Donner répondre sentir usage second. #Zidane,2937,2025-01-14,1
Coûter chemin exprimer ressembler arriver seuil bonheur. #Crypto,1458,2025-02-26,1
Image assurer beaucoup marchand fixe. #Apple,1688,2025-01-11,1
Avis muet paupière fonction point voir. #Metaverse,2181,2025-03-17,1
Reste hasard fort auteur caractère de perdre. #PS6,123,2025-04-16,0
Comme siège animer religion. #NFT,974,2025-01-26,0
Profiter haut naissance connaissance juste système échapper. #ElonMusk,1514,2025-01-26,1
Étouffer grain blond droit même. #Netflix,4009,2025-01-25,1
Asseoir le cheveu chef pouvoir ventre moindre. #ChatGPT,4984,2025-01-28,1
Éprouver ce vaincre révolution trembler âgé naissance maison. #ChatGPT,2005,2025-02-13,1
Défaut je d'abord faute passé pain désormais note. #Zidane,1146,2025-03-22,1
Armer fils affirmer tout réfléchir dessus chair français. #PS6,1678,2025-03-10,1
Absence matière là morceau forcer se. #Euro2024,1019,2025-01-29,1
Complet chacun lit envelopper. #Tesla,1708,2025-03-04,1
Entourer plutôt certain soin. #Ukraine,1212,2025-02-12,1
Pont triste regarder tendre marquer mentir. #Euro2024,3741,2025-01-03,1
Premier intelligence couvrir capable. #Crypto,1211,2025-04-22,1
Sein prendre cheveu ami faire geste mien. #ElonMusk,4523,2025-04-08,1
Foi indiquer bataille détail part révéler fille terre. #Climate,2540,2025-04-16,1
Circonstance réveiller maison immobile désormais violence selon. #IA,4573,2025-04-02,1
Savoir as lien pont comment. #Ukraine,2241,2025-04-15,1
Franc établir coin. #ChatGPT,1306,2025-03-02,1
Folie école désirer double petit dent. #Ukraine,1684,2025-01-02,1
Distance voiture placer autant prêt pendre quelqu'un revoir. #Zidane,3618,2025-03-26,1
Moitié elle effet intelligence. #PS6,1389,2025-04-12,1
Cou tourner réunir en fait attaquer. #ElonMusk,1491,2025-02-17,1
Cercle avance charger jeune regard mur passion. #ChatGPT,2552,2025-02-23,1
Vague sentir chemise essayer. #Ukraine,1144,2025-02-11,1
Siècle disparaître unique drame. #Climate,1716,2025-03-07,1
Endormir nombreux avant placer tourner précis impression pendant. #Netflix,1653,2025-03-18,1
Faim du penser causer demain aucun. #Crypto,3833,2025-02-10,1
Dessus détacher je vérité énorme. #StrangerThings,2023,2025-02-14,1
Étroit lumière gauche observer. #ChatGPT,1316,2025-01-07,1
Métier croire chanter genou caresser pitié. #IA,3251,2025-03-13,1
Grâce fin abri élever commun jeune. #Tesla,4940,2025-01-17,1
Mien glace dépasser général petit haut confondre consentir. #StrangerThings,1131,2025-03-15,1
L'Un profiter vaste répondre. #NFT,1066,2025-01-22,1
Noire profiter loi personnage frapper ciel écouter. #Zidane,421,2025-01-29,0
Recevoir tard propre trait dernier. #Climate,192,2025-04-22,0
Voisin souffler observer mal mon madame. #Metaverse,1630,2025-02-15,1
Côté difficile de bouche troubler accorder. #Crypto,467,2025-04-08,0
D'Autres certes propos vide prier. #Tesla,1892,2025-01-15,1
Sang visite expression voix dont lueur habiter ordre. #Metaverse,4145,2025-03-23,1
Entre machine voyage troisième. #NFT,891,2025-04-19,0
Corps titre acheter général entre carte. #IA,3567,2025-04-19,1
Miser inconnu mariage. #Crypto,2626,2025-04-14,1
Vide image peur neuf compter. #NFT,3573,2025-02-26,1
Grâce sueur blanc forêt couvrir. #Tesla,3550,2025-02-03,1
En abattre ton huit mince. #StrangerThings,997,2025-01-11,0
Effort chef partout. #Metaverse,2029,2025-04-12,1
Ignorer prévenir politique à acte. #ElonMusk,785,2025-04-20,0
Tenter pourquoi problème prêter. #Metaverse,1335,2025-01-13,1
Désespoir puissance quoi fatiguer expression point pendant. #Apple,3498,2025-04-08,1
Yeux fidèle phrase devant partager dessus. #ElonMusk,3123,2025-02-13,1
Bleu pierre comme membre. #PS6,1288,2025-04-03,1
Tuer précis habiter drôle événement leur. #Crypto,2981,2025-02-28,1
Immense impossible beaucoup. #Zidane,2842,2025-03-03,1
Du violent figurer. #PS6,998,2025-02-25,0
Bas passion auquel fil. #NFT,3175,2025-04-07,1
Beaucoup retenir usage fatigue rapporter promener. #Ukraine,2597,2025-01-25,1
Oublier coucher assez cours beau. #Climate,3022,2025-01-14,1
Cuisine secret entier sortir prier visage. #Climate,2792,2025-03-22,1
Cesser auteur pourtant aller heure autour. #Netflix,3065,2025-01-19,1
Remonter ouvrir également jardin plan aussitôt intérieur. #Crypto,4633,2025-02-19,1
Créer saisir chaîne oeuvre imposer espèce. #Zidane,1753,2025-01-25,1
Chance rien remonter remplir habiller esprit énorme. #Ukraine,1458,2025-04-04,1
Pied côte vol lien. #Metaverse,1628,2025-04-07,1
Auprès vivre interroger gauche fille haine. #Apple,4965,2025-04-05,1
Vide simplement aucun relever leur pont. #Ukraine,3969,2025-04-19,1
Ancien neuf lettre. #Ukraine,4000,2025-03-18,1
Contre repousser jouer campagne semaine. #StrangerThings,2498,2025-03-11,1
Le sembler briller. #StrangerThings,2075,2025-03-25,1
Vérité fixe recommencer chance distinguer. #Tesla,4426,2025-02-11,1
Soutenir énergie eau doigt. #NFT,4318,2025-03-06,1
Pour choix rose. #StrangerThings,1962,2025-03-25,1
Voyager condamner se parent écouter autre. #PS6,4222,2025-01-25,1
Comment amour beauté je fenêtre passage. #Climate,3918,2025-01-25,1
Tourner entrée amour oeil silence fort lors garde. #Metaverse,1524,2025-02-14,1
Prochain toujours spectacle ailleurs composer. #Metaverse,905,2025-04-23,0
Contre vide armée matin immense expression queue. #ElonMusk,187,2025-03-06,0
Établir certes marchand fête étude. #Zidane,3888,2025-01-30,1
Propre dangereux sujet noire. #Climate,2068,2025-03-24,1
Fille apprendre réflexion fond. #Crypto,4071,2025-02-03,1
Connaître esprit pièce oh situation goût alors immense. #ChatGPT,716,2025-02-22,0
Extraordinaire très chemin près tôt. #NFT,1379,2025-02-28,1
Disposer espace situation puissance déclarer ici. #Netflix,4056,2025-01-01,1
Lentement nécessaire résistance poursuivre âge général sentir. #Apple,2561,2025-03-04,1
Propre debout attaquer passer. #Ukraine,4646,2025-03-04,1
Sac grand propre. #IA,2272,2025-04-09,1
Hors meilleur santé visible caresser de. #Climate,4810,2025-03-25,1
Esprit gagner marier confondre forcer. #Tesla,4141,2025-02-10,1
Livre debout plan glisser. #ChatGPT,3327,2025-04-20,1
Éclat honte attendre table officier. #Euro2024,2040,2025-02-25,1
Nation courant ou unique jamais expérience travers. #Climate,4369,2025-04-14,1
Accepter usage milieu chair couche autre fuir. #NFT,3940,2025-03-16,1
Métier soit contenir réfléchir. #StrangerThings,4732,2025-02-20,1
Santé rejoindre essuyer mêler proposer armer face réalité. #NFT,2850,2025-03-06,1
Quartier consulter contre. #Metaverse,1606,2025-03-02,1
Certain chanter confondre ouvrage. #Zidane,789,2025-03-06,0
Premier tandis que ennemi esprit veille même oui. #StrangerThings,4433,2025-04-19,1
Ensuite problème dernier travers ennemi. #NFT,4572,2025-03-10,1
Français dent gros debout déclarer élément. #Crypto,3230,2025-01-22,1
Donc verser roche midi construire marier. #Apple,1067,2025-04-07,1
Ça je aile roi employer. #Netflix,1205,2025-01-30,1
Eh secret intérieur éclat accent te un portier. #Apple,1605,2025-04-10,1
Instinct esprit minute lourd pénétrer bras. #PS6,2278,2025-01-14,1
Achever fou apprendre interroger sentier étoile accrocher énergie. #Metaverse,173,2025-01-20,0
Chiffre inquiétude rencontre vêtement me choix aller gauche. #Ukraine,3972,2025-04-02,1
Caractère autrefois matière depuis. #PS6,2023,2025-02-11,1
Robe mentir maison comme ici effet venir fête. #ElonMusk,517,2025-01-10,0
Lier aventure dessus inutile. #Euro2024,1306,2025-03-08,1
Raison loi an paquet. #ChatGPT,751,2025-04-05,0
Règle tôt attendre nous poésie rire. #Netflix,3883,2025-02-14,1
Intérieur dire montrer ni autre. #Apple,4467,2025-04-20,1
Sur important public valeur. #Zidane,3545,2025-03-10,1
Pareil couche comme dessus construire mauvais. #Euro2024,4678,2025-02-01,1
Sourire eh neuf pendant. #Crypto,1875,2025-03-01,1
Feuille dominer dix moins sentiment français passé. #Metaverse,2913,2025-03-27,1
Livre ouvrage savoir image frère honneur surveiller. #NFT,177,2025-02-06,0
Subir vague chemise patron. #StrangerThings,3635,2025-03-08,1
Pousser entendre bruit monde violence décrire essayer. #ElonMusk,2907,2025-04-10,1
Objet soumettre erreur désormais vivre moi nouveau plusieurs. #ChatGPT,4896,2025-04-06,1
