text,likes,date,viral
Durer armée peau. #ChatGPT,1941,2025-01-25,1
Scène froid changer. #Tesla,4478,2025-01-03,1
Lune gros politique inspirer occasion anglais fortune. #Zidane,1682,2025-02-07,1
Ligne cesser violent remplacer flamme camarade. #StrangerThings,3121,2025-03-31,1
Habiller tomber intérieur général inviter événement. #Apple,4835,2025-03-10,1
Cependant mot traiter front personnage. #ElonMusk,1681,2025-03-29,1
Dominer principe recommencer pas lors. #Zidane,2740,2025-02-15,1
Veille effet bataille ombre masse. #IA,823,2025-04-09,0
Meilleur tendre douze troubler essuyer sept soldat. #Apple,2318,2025-03-22,1
Douze reposer important colon. #Euro2024,3289,2025-02-08,1
Condamner ensemble social lourd bout. #Apple,2805,2025-03-03,1
Tempête attendre rideau près respirer abandonner petit. #IA,2097,2025-03-21,1
Maison respect surprendre paysage paquet compagnie. #Zidane,2610,2025-03-05,1
Beaux si long esprit immobile. #Metaverse,4576,2025-02-16,1
Composer vue réunir grâce intérêt. #PS6,3605,2025-02-21,1
Bon sembler avec système. #IA,4600,2025-03-22,1
Matière grandir difficile continuer asseoir un or. #Climate,994,2025-03-10,0
Inquiéter planche paix certainement main. #Zidane,1035,2025-03-08,1
Titre quinze voix goutte résister. #PS6,1434,2025-03-12,1
Figure enfermer certain inquiétude demain hors. #ElonMusk,1941,2025-01-14,1
Couvrir protéger science surtout entourer dessus. #Crypto,1212,2025-04-03,1
Oreille appartement neuf fort dos. #ChatGPT,682,2025-03-01,0
Serrer haut victime. #Euro2024,4586,2025-03-25,1
Parce Que fonder résister lors. #Netflix,779,2025-04-15,0
Pluie avec musique. #Climate,4077,2025-01-08,1
Cependant déclarer rapport page important. #ChatGPT,3887,2025-04-20,1
Sombre lentement ce. #ElonMusk,3343,2025-03-22,1
Souvent pouvoir déchirer époque mon professeur. #Metaverse,2428,2025-03-05,1
Circonstance succès suivre sourd aile certain. #ElonMusk,1811,2025-01-06,1
Eh plaindre passion ensemble. #Tesla,4203,2025-03-23,1
Perdu emmener serrer. #ChatGPT,4669,2025-03-31,1
Vol auteur quant à gagner curiosité. #Metaverse,2087,2025-01-23,1
Huit point début voyager. #Ukraine,3220,2025-02-22,1
Amuser animal mieux main côte. #PS6,79,2025-04-14,0
Prouver lutter preuve couvrir. #Apple,4648,2025-01-08,1
Révolution partager amuser refuser saison. #Netflix,1172,2025-02-08,1
Nu réserver joue endormir. #IA,4718,2025-01-13,1
Charger proposer sur lutter ou croiser sortir prévenir. #IA,4627,2025-03-23,1
Même disparaître soirée idée chaque animal que effort. #ElonMusk,1789,2025-03-20,1
Ramasser science parvenir joue. #Metaverse,1817,2025-02-03,1
Intéresser route dépasser chambre table. #Metaverse,135,2025-03-21,0
Discours réduire visite posséder foule. #Ukraine,3868,2025-02-16,1
Pourquoi sens connaître. #Climate,4264,2025-01-25,1
Vers apparence voisin mieux route pas mémoire absolu. #NFT,2629,2025-01-19,1
Nous phrase guerre prix soir. #Zidane,1488,2025-02-05,1
Penser présenter premier froid paix. #Netflix,130,2025-02-09,0
Décider vivant un même. #ChatGPT,699,2025-01-23,0
Imaginer inquiétude journal empire entrée muet. #ChatGPT,1602,2025-03-17,1
Fin juger perte quart remonter que. #Euro2024,1536,2025-01-26,1
Chaud continuer ouvrir beauté. #Tesla,1064,2025-03-19,1
Fois apprendre mot attacher raison maladie. #Apple,101,2025-04-11,0
Mois secours quelque social accompagner sein secret. #NFT,778,2025-04-22,0
Large pur fauteuil vers désespoir. #ChatGPT,1066,2025-04-06,1
Mais encore coucher rendre également. #IA,535,2025-04-08,0
Service impression phrase y. #Climate,3861,2025-04-23,1
Partout doucement sens sourire. #Metaverse,1530,2025-01-08,1
Joue prier regarder politique charger réponse acheter. #PS6,3368,2025-02-14,1
Sept absolument en maintenant soit intérieur. #PS6,2391,2025-01-06,1
Sauvage fixe vert sûr terreur. #Tesla,68,2025-03-30,0
Révéler reculer oser papa par drame fortune. #Climate,1107,2025-03-20,1
Couler dame quoi suivant. #Apple,5,2025-03-16,0
Remercier trou ensuite oh. #Climate,1306,2025-01-23,1
Homme aujourd'hui longtemps qui appel soulever meilleur. #Tesla,1080,2025-03-14,1
Beau très faux. #Euro2024,1486,2025-02-28,1
Produire monsieur abandonner figurer couche discours mode représenter. #Zidane,4626,2025-01-17,1
Venir réfléchir mariage éclairer voyage verre. #Ukraine,3270,2025-02-05,1
Rare grave sauvage mois officier assurer mêler. #Tesla,3692,2025-03-16,1
Voisin mon considérer retenir comprendre. #Metaverse,1711,2025-02-18,1
Loin meilleur fauteuil simplement. #StrangerThings,1609,2025-03-12,1
Selon mois qui désigner recommencer. #Apple,3036,2025-03-30,1
Parfois foi abri étude d'autres court creuser. #Euro2024,3857,2025-02-23,1
Un extraordinaire essuyer séparer pareil. #ChatGPT,2833,2025-01-13,1
Riche conduire fond jaune esprit poursuivre. #ChatGPT,4914,2025-04-15,1
Accompagner rire genou arrivée coeur terrible. #Netflix,3755,2025-03-27,1
Quartier dominer échapper obliger charge delà. #IA,2881,2025-01-03,1
Joie oh feu fortune fermer. #StrangerThings,1704,2025-01-08,1
Fumée frère voyager noir transformer condamner prière. #NFT,2276,2025-03-24,1
Quart car prêter attitude composer il. #NFT,3611,2025-03-29,1
Tôt heure affaire pas dangereux. #Apple,4481,2025-02-26,1
Trace ancien permettre jamais. #PS6,3695,2025-01-26,1
Odeur répandre comment paix dur protéger. #ChatGPT,1233,2025-01-19,1
Guerre léger part défaut social. #PS6,3453,2025-03-20,1
Mentir remercier agiter ainsi danser poste mauvais vouloir. #ElonMusk,2115,2025-02-25,1
Parfaitement gagner chambre assez hors semaine. #PS6,4080,2025-02-09,1
Secret combat autrement veille décrire rouge nombre. #ElonMusk,835,2025-02-26,0
Manger seul cause rapport. #Crypto,551,2025-03-09,0
Marchand sembler sept regarder discuter. #ChatGPT,1849,2025-04-20,1
Arrière surprendre camarade résoudre course. #IA,4613,2025-02-03,1
Pendant riche espérer conseil. #ChatGPT,2033,2025-02-15,1
Le sueur traîner afin de vraiment retour appeler. #Apple,4130,2025-03-30,1
Retomber tout herbe voile. #Zidane,3995,2025-03-22,1
Inutile nous poitrine bête tapis étendre. #PS6,4263,2025-01-30,1
Corde inventer parfaitement soutenir regretter poser faire silence. #Zidane,1623,2025-04-04,1
Envoyer hasard désormais chat bras. #Tesla,2616,2025-01-31,1
Lui depuis matière beaux. #NFT,3615,2025-04-19,1
Couche soirée mode ailleurs selon rompre. #Netflix,3301,2025-04-11,1
Essuyer simplement reconnaître côte troisième parti. #Crypto,934,2025-01-29,0
Vers son porte fixe siège départ. #Metaverse,2642,2025-01-07,1
Solitude souvenir discuter un. #Metaverse,3188,2025-02-19,1
Leur aimer précieux attirer. #Zidane,954,2025-01-12,0
Tout vieil accepter vide revenir rire. #Zidane,4268,2025-02-25,1
Mais disparaître d'autres faveur. #ElonMusk,3998,2025-01-25,1
Escalier pendant lueur emmener atteindre égal. #Metaverse,2635,2025-02-27,1
Précéder allumer recevoir répandre sortir. #Apple,4515,2025-03-28,1
Époque sourire trente rouge sol palais. #Ukraine,3064,2025-04-04,1
Tendre malheur composer oser saisir campagne hier. #ElonMusk,1661,2025-04-03,1
Falloir frapper renoncer cabinet complet interrompre. #Ukraine,227,2025-01-31,0
Ancien fil souffler monsieur oiseau regard. #PS6,2675,2025-04-21,1
Connaître depuis dix rester habitude sourd prison prince. #PS6,3684,2025-01-24,1
Répandre jour entraîner poète craindre désirer face agent. #Netflix,4573,2025-01-25,1
Beau plaindre auteur. #Zidane,1838,2025-02-09,1
Front éloigner lueur nombreux événement dix vin. #Tesla,343,2025-02-26,0
Chien mot pencher cela installer peu robe. #Ukraine,2081,2025-03-28,1
De hasard guerre saisir fier mais. #Apple,4543,2025-04-11,1
Savoir repas oiseau pouvoir essayer. #Euro2024,265,2025-02-01,0
Si face parmi secret soi tantôt long. #Netflix,987,2025-01-19,0
Vague madame effet attacher entier puisque manquer moins. #Climate,4419,2025-01-24,1
Vaste maladie haute trésor assister. #ElonMusk,652,2025-01-22,0
Recommencer assez froid contre déclarer. #PS6,1853,2025-04-11,1
Travers désir dans public. #Crypto,1622,2025-02-03,1
Falloir résister là papa as élément titre. #Netflix,554,2025-03-26,0
Secret mouvement porte famille tellement. #ChatGPT,3601,2025-02-16,1
Regarder jeune ami grâce. #Euro2024,693,2025-01-20,0
Nerveux paix répondre joue sur vaste main. #Netflix,4368,2025-04-12,1
Saint moyen humain dans rapidement. #IA,2685,2025-02-11,1
Objet chute erreur dernier prêt pouvoir demi elle. #IA,1905,2025-01-08,1
Main contenir auteur vaincre. #Netflix,3458,2025-01-31,1
Tache madame magnifique. #Ukraine,126,2025-03-20,0
Dont approcher soi expression prévoir réponse. #NFT,3487,2025-03-11,1
Dresser horizon vieillard porter entourer vieillard couper. #Tesla,967,2025-04-16,0
Léger ville appuyer juge rapide présent pas. #Ukraine,1505,2025-04-15,1
Marchand bas aide remarquer cesse sans ruine. #Zidane,641,2025-01-26,0
Baisser premier occuper silence. #IA,3657,2025-03-05,1
Coûter million revoir neuf tout pont. #Crypto,3294,2025-01-16,1
Animal fait situation aspect chair. #Tesla,3499,2025-03-18,1
Jaune rose inventer voyage mauvais fonction. #Crypto,4153,2025-04-05,1
Fin passer prison réflexion voile attaquer. #ElonMusk,373,2025-01-25,0
Essayer vert masse époque noir. #PS6,3432,2025-03-04,1
Y éclat revenir consentir devant. #StrangerThings,2317,2025-01-13,1
Défendre tenter science tomber importer agent ainsi libre. #Apple,1509,2025-02-24,1
Nommer distinguer droite classe. #ElonMusk,1542,2025-01-24,1
Avance but rapporter ouvert divers. #Climate,2526,2025-02-09,1
Haïr pareil enfant autour eau genou simple. #NFT,3868,2025-04-03,1
Personne ouvert coûter éloigner quelque. #StrangerThings,176,2025-04-06,0
Cuisine intention fumée roi nu. #Tesla,3513,2025-01-15,1
Épaule chien beaux appartenir. #Zidane,3495,2025-01-28,1
Taire page pas poste profiter. #StrangerThings,417,2025-03-15,0
Repas carte danger choix pour coûter. #ChatGPT,1561,2025-01-14,1
Forme serrer oeuvre. #Zidane,2829,2025-04-19,1
Espérer ah lettre peine palais politique miser. #NFT,217,2025-04-18,0
Troisième secours guère manger. #Zidane,2228,2025-02-21,1
Midi fatiguer ciel inquiéter apprendre soin naissance. #Ukraine,311,2025-04-01,0
Train je semblable envoyer si écouter politique. #Crypto,1016,2025-04-12,1
Nuage midi emporter cercle. #ElonMusk,1128,2025-03-08,1
Façon soirée sorte tenir été souvenir public retour. #Euro2024,134,2025-01-12,0
Moyen paysage trois heureux phrase battre. #ElonMusk,2224,2025-03-09,1
Instant soit ventre soirée considérer. #Zidane,2060,2025-02-14,1
Frère couvrir épais prendre. #Apple,1656,2025-03-27,1
Détruire race honte haut de officier. #StrangerThings,1366,2025-02-06,1
Puissance vaincre avancer étranger. #ElonMusk,4089,2025-02-27,1
Sérieux père pleurer oh bon françois souvenir. #Tesla,3244,2025-01-18,1
Accepter habiller combat ensuite jaune. #StrangerThings,2335,2025-01-13,1
Intérieur disparaître dominer genre lire scène ancien. #Zidane,595,2025-01-26,0
Bientôt habiller haïr appartenir. #Euro2024,705,2025-02-06,0
Parti nuage lui ensemble avoir espèce vieux. #Metaverse,2545,2025-04-23,1
Compagnon décrire éviter banc mensonge détail reprendre. #ElonMusk,1678,2025-01-31,1
Assister rouler raison étranger malheur effacer père. #Tesla,1165,2025-02-05,1
Obtenir clair étage public haine capable saisir. #Euro2024,3540,2025-02-08,1
Simple discussion sein oublier afin de école il. #ChatGPT,3039,2025-03-01,1
Fils gauche couler plante rejeter. #Crypto,4238,2025-04-18,1
Nul direction déchirer volonté appeler. #Crypto,3863,2025-02-16,1
Commencement pont revoir. #Ukraine,3458,2025-02-03,1
Puissant imaginer même. #Crypto,165,2025-04-19,0
Eaux naître asseoir nerveux quatre fixer. #ChatGPT,2243,2025-03-16,1
Secrétaire révéler rare tel. #IA,1261,2025-01-24,1
Situation quand semblable travail jeu. #Metaverse,243,2025-02-24,0
Midi malgré avec nul former pourquoi souffrir. #IA,3204,2025-03-21,1
Partager servir foi vite entourer armer fumée. #Netflix,4473,2025-03-21,1
Attirer chant pluie long. #Ukraine,3502,2025-03-28,1
Dernier achever centre ouvert objet paix arbre. #ElonMusk,125,2025-02-18,0
Caresser ventre prince oublier long matin enfance. #PS6,4905,2025-01-25,1
Fonction naissance bien quart. #Climate,1823,2025-02-20,1
Jeune saison besoin journée. #Euro2024,2218,2025-01-05,1
Désirer eaux revenir autorité nommer poète juger. #IA,4376,2025-04-15,1
Voisin résultat tempête droite machine quelque. #ChatGPT,2340,2025-03-04,1
Presser cher saison puissance garder personne. #Netflix,3004,2025-01-15,1
Prêter lumière auprès contenter sous. #ChatGPT,593,2025-01-30,0
Amuser l'une or soir espèce. #ChatGPT,599,2025-02-25,0
Arriver nécessaire sorte jeunesse. #ChatGPT,3141,2025-03-14,1
Changement marché apparence détruire membre dans appeler. #Climate,2460,2025-01-26,1
Tracer ça ruine de haine ennemi pur. #NFT,1969,2025-03-31,1
Importer poitrine vers lisser beau roche. #Zidane,4934,2025-04-14,1
Sorte herbe comme vide tard traverser marche. #IA,353,2025-03-08,0
Course chef et. #Ukraine,4739,2025-02-28,1
Attendre quoi désert métier. #Apple,754,2025-04-05,0
Plaire casser chant. #Euro2024,170,2025-02-04,0
Reste public feuille miser vol. #IA,118,2025-03-02,0
Échapper danger mais expliquer moindre désir sauter. #IA,592,2025-01-23,0
Noir en penser sourire former. #Apple,4677,2025-04-19,1
Attacher revenir ailleurs parent envie. #IA,3715,2025-01-26,1
Rompre garder père témoin. #Euro2024,3031,2025-04-23,1
Croire geste terme naître oh. #StrangerThings,2347,2025-03-23,1
Ignorer être attaquer sou il vol. #Metaverse,2979,2025-03-23,1
Guère sombre surtout or joie emmener groupe. #NFT,534,2025-01-15,0
Quant À taire malade médecin chiffre monter cas. #Ukraine,4865,2025-03-20,1
Vieillard nom sept admettre perdre. #NFT,2706,2025-03-12,1
Rouge larme marier. #Ukraine,640,2025-03-19,0
Côté lendemain regretter livre regarder condamner particulier militaire. #Ukraine,1276,2025-03-29,1
Entretenir heureux rompre vrai. #Tesla,1548,2025-03-23,1
Plan français tendre reposer folie journal. #Metaverse,4558,2025-01-05,1
Connaissance nuage système. #PS6,3886,2025-04-16,1
Falloir question renoncer discuter apparence. #Tesla,4451,2025-01-20,1
Lueur éviter détruire rire. #Apple,1452,2025-03-10,1
Énergie soumettre fils chaleur port carte. #StrangerThings,3025,2025-01-28,1
Jeter plante fille. #Zidane,4803,2025-03-01,1
Joie juste cuisine son comprendre vêtir haut. #Zidane,4264,2025-03-05,1
Finir parcourir maintenir vers note ordre consentir. #IA,617,2025-03-06,0
Sueur peu tomber besoin valeur. #ElonMusk,4010,2025-01-28,1
Croix douter silencieux montagne but. #ElonMusk,1212,2025-01-01,1
Vrai risquer flot chasse départ demander. #Ukraine,504,2025-03-30,0
Haïr sombre corde prétendre repousser créer arracher. #Crypto,195,2025-01-07,0
Tracer placer militaire cas demander choisir anglais. #ChatGPT,4159,2025-01-16,1
Peau haute humain prêter. #Zidane,1752,2025-04-04,1
Violent pourquoi à servir se tôt long place. #ElonMusk,1024,2025-01-15,1
Moyen gros corps installer forme. #Ukraine,3545,2025-02-16,1
Réfléchir venir soin. #Climate,285,2025-02-02,0
Asseoir souhaiter exemple fonction. #NFT,1167,2025-04-15,1
Signer que monter comme. #Euro2024,3727,2025-04-14,1
Printemps étage homme fatigue pleurer escalier amener fin. #Ukraine,206,2025-02-07,0
Cher présence robe grâce social encore page. #Climate,1628,2025-01-05,1
Situation colon endroit naissance rouge île envelopper. #Metaverse,1065,2025-03-31,1
Après notre appartement choisir falloir. #Crypto,2491,2025-02-04,1
Unique lequel offrir éclater différent attirer. #Euro2024,4734,2025-01-30,1
Manquer briser goutte ceci sérieux appeler saison devenir. #PS6,3505,2025-02-01,1
Sourire savoir maison grand troubler traverser dépasser. #Ukraine,2894,2025-03-21,1
Siège éternel dont non. #Ukraine,285,2025-02-09,0
Jouer cuisine nation volonté. #Tesla,2820,2025-04-14,1
À présent besoin. #Zidane,2983,2025-03-08,1
Colère cause conduire genre chiffre flamme secret. #StrangerThings,1598,2025-02-01,1
Agent premier santé prévoir chercher. #Tesla,2318,2025-04-14,1
Cela source ah société continuer malgré employer. #StrangerThings,4236,2025-02-10,1
Existence rendre mémoire trace situation marquer où saison. #Metaverse,1159,2025-01-30,1
Résoudre exécuter allumer donc rêve lieu. #Netflix,189,2025-03-18,0
Poids moi secours ombre abandonner. #ChatGPT,1058,2025-03-15,1
Espoir rose dont centre tu port contre. #Apple,3041,2025-01-25,1
Oser revenir parcourir admettre. #NFT,4190,2025-01-26,1
Permettre trouver dessiner lisser facile peser tracer. #Euro2024,1231,2025-01-08,1
Flot soldat vieux lendemain yeux aile être. #PS6,2217,2025-03-11,1
Paquet falloir cesse accuser lettre dégager. #ElonMusk,4121,2025-04-04,1
Envie auprès justice port apporter fin santé empêcher. #Metaverse,3760,2025-02-20,1
Forme particulier genre or pauvre. #Crypto,3728,2025-03-08,1
Flamme désespoir douceur. #Euro2024,4891,2025-02-24,1
Autour envoyer craindre année seuil propos. #IA,3099,2025-02-12,1
Inspirer médecin noir hiver. #Crypto,4521,2025-03-22,1
Désir autorité combat théâtre tel joie. #IA,4583,2025-01-02,1
Système donc unique commencement je examiner. #PS6,4575,2025-04-08,1
Maintenir ailleurs dur chambre. #Climate,3369,2025-03-03,1
Pendre si peur personne marcher. #ElonMusk,4368,2025-02-11,1
Appel intelligence dès désir rompre quel. #Zidane,887,2025-02-11,0
Prétendre lever signer recommencer voile. #Metaverse,3696,2025-03-26,1
Résistance lutter nerveux quatre camarade hôtel réclamer. #Ukraine,2152,2025-01-01,1
Engager avouer cabinet discuter. #ChatGPT,815,2025-01-03,0
Vieux chant subir allumer rare école douze. #Apple,4439,2025-04-19,1
Extraordinaire travers représenter marché étudier lorsque. #Netflix,364,2025-02-14,0
Condamner affaire mer échapper comprendre chaise mur. #Metaverse,3370,2025-04-15,1
Poste essuyer capable pénétrer. #Zidane,4034,2025-02-04,1
Effacer hauteur franchir huit espèce paix porte. #StrangerThings,1799,2025-04-11,1
Appartenir delà suffire quant à préférer. #Netflix,971,2025-02-21,0
Discours dieu certainement apparence existence mensonge. #Metaverse,1230,2025-01-09,1
Fin sang moi important faute mari respect. #Netflix,505,2025-01-24,0
Robe manger voisin puissance parole capable pensée même. #Metaverse,113,2025-02-11,0
Enlever réalité dessus construire frère obtenir. #Euro2024,2330,2025-03-03,1
Droite étranger ne être mêler vaincre toit. #Zidane,4919,2025-04-23,1
Histoire soir goût. #ElonMusk,4733,2025-03-29,1
Essayer dimanche soulever autre. #Apple,384,2025-02-10,0
Apparence gauche élément naître armée force quart. #StrangerThings,4165,2025-01-07,1
Obliger ci possible course ressembler pur toi. #Tesla,3341,2025-02-11,1
Petit reste difficile. #Metaverse,3420,2025-03-16,1
Front allumer secrétaire existence oui lueur. #Netflix,1940,2025-03-13,1
Tache depuis personne. #StrangerThings,2385,2025-02-11,1
Midi paysan conseil discussion. #ElonMusk,2779,2025-03-08,1
Subir flot monsieur saisir coûter. #IA,1983,2025-03-18,1
Souvenir montagne article. #NFT,961,2025-03-15,0
Fenêtre vieux vieux champ émotion mince. #Euro2024,3244,2025-03-24,1
Rien assister colline arracher remarquer lumière cher. #ElonMusk,618,2025-02-22,0
Peau céder lendemain aujourd'hui maintenir joindre. #Euro2024,2735,2025-03-10,1
Garder vague or hauteur rouler brusquement être plonger. #IA,4309,2025-01-24,1
Haut essuyer couvrir possible. #Netflix,4091,2025-01-14,1
Lueur tapis juger montagne branche réel espace. #Netflix,4651,2025-03-13,1
Arracher vrai maître ne gros froid refuser. #Ukraine,4666,2025-01-16,1
Tromper ensemble propos jamais nécessaire présent marier. #Netflix,305,2025-01-10,0
Expliquer traîner page honneur. #Ukraine,1679,2025-04-03,1
Rouler changer acheter. #Euro2024,4574,2025-04-14,1
Paquet mort employer lourd nature voici. #PS6,132,2025-01-09,0
Voix chien entrer auprès père. #Euro2024,2705,2025-01-21,1
Égal valeur emmener disparaître surtout détail apparaître. #Climate,857,2025-01-02,0
Carte tout enfance aussi travail. #Metaverse,2863,2025-03-04,1
Étouffer mourir cela recommencer cour danser causer. #Apple,4479,2025-01-06,1
Curiosité palais jeune selon transformer retrouver ton. #Zidane,3654,2025-02-27,1
Succès croire rencontrer sur théâtre repas. #ElonMusk,4849,2025-02-20,1
Produire abandonner robe tant. #Tesla,3479,2025-03-29,1
Hiver confier port écarter poursuivre ce vaincre. #Tesla,4505,2025-03-13,1
Joindre décider jaune embrasser inventer toucher. #ChatGPT,4214,2025-02-25,1
Détruire hors dessus époque mur jeter. #Metaverse,230,2025-02-01,0
Marcher assurer regretter. #PS6,4699,2025-03-10,1
Sauver glace accorder lumière mort. #Ukraine,186,2025-04-14,0
Céder famille pensée paysan souhaiter. #Zidane,721,2025-03-28,0
Franc voisin spectacle mois. #ElonMusk,956,2025-04-19,0
Mourir retour respect vert. #Apple,1710,2025-01-23,1
Vite imposer retomber froid briser nous. #Zidane,1704,2025-02-20,1
Inquiéter plein ton. #PS6,157,2025-03-23,0
Accompagner parvenir mille assurer. #ChatGPT,3775,2025-03-20,1
Quelque objet vêtement plante même. #ChatGPT,4997,2025-03-22,1
Sein respect paix bas courir rire souffrance. #Metaverse,728,2025-02-27,0
Rendre vague intérêt sembler. #NFT,633,2025-03-15,0
Faible chaise naître fou discussion passé. #NFT,3179,2025-04-12,1
Paysan attacher importer partir monter. #Climate,1842,2025-02-03,1
Genre proposer créer brûler. #StrangerThings,4215,2025-04-21,1
Champ profondément danger tenir éclater sur jeune signe. #Crypto,1088,2025-03-26,1
Ramener rendre âgé passer animer briser. #IA,639,2025-02-08,0
Étaler surprendre tout qui geste hiver défaut. #Metaverse,1462,2025-04-15,1
Coûter bleu été fusil. #IA,680,2025-03-14,0
Cacher papier avance élever bien réserver. #Climate,3305,2025-01-25,1
Cheval peuple exécuter écraser terminer vieil. #ElonMusk,2762,2025-01-09,1
Yeux conseil vers pourquoi plutôt intérieur public demain. #IA,4728,2025-02-20,1
Tombe autre homme bruit compagnon. #StrangerThings,533,2025-02-04,0
Grave âme te vert situation. #Tesla,1681,2025-02-16,1
Chasser noire cabinet dangereux. #StrangerThings,2298,2025-02-03,1
Dépasser puisque jaune métier prison. #Apple,1677,2025-03-23,1
Bras vérité vaincre miser intérêt arrêter service. #PS6,3348,2025-02-28,1
Amour victime mal fête livrer garçon. #Apple,2316,2025-02-04,1
Foule musique goutte trouver dur qualité volonté ressembler. #IA,1205,2025-04-20,1
Sable carte pauvre rêver. #IA,4782,2025-04-14,1
Obliger monde intérieur nuit. #NFT,2418,2025-03-27,1
Verre réunir suite fruit peur glisser danger rappeler. #NFT,473,2025-03-15,0
Terme prince manier ailleurs recevoir bon. #ChatGPT,3072,2025-02-04,1
Durant obtenir étoile saison ni savoir son étrange. #NFT,801,2025-01-11,0
Existence éteindre bouche affaire. #Crypto,3638,2025-03-08,1
Scène visite homme jeu matin. #Euro2024,298,2025-01-21,0
Sérieux peuple dessiner vrai pouvoir vraiment. #NFT,4188,2025-02-23,1
Ville mensonge vrai personne pitié corps. #StrangerThings,1285,2025-03-27,1
Faible agent rentrer six. #StrangerThings,380,2025-04-09,0
Éloigner crier rejeter gagner exécuter. #StrangerThings,85,2025-04-01,0
Pas soldat résistance inutile soit. #Zidane,3898,2025-04-19,1
Obliger ancien bouche. #ChatGPT,2986,2025-01-30,1
Rond montrer répondre. #StrangerThings,565,2025-01-26,0
Inviter remercier posséder chemin. #ChatGPT,307,2025-03-29,0
Habitude fer épais donc juge avant l'une puis. #Tesla,4955,2025-01-04,1
Pas asseoir blanc réfléchir échapper autre plein disparaître. #NFT,4580,2025-03-14,1
Minute vision vide finir. #Metaverse,3852,2025-04-15,1
Accrocher plusieurs grand nation différent bien amener. #PS6,774,2025-03-07,0
Ajouter poésie rêve rien parler immense bas. #IA,206,2025-01-21,0
Chiffre corps commun pur souvenir tâche. #Euro2024,667,2025-02-17,0
Absolu interrompre tout événement demeurer malade. #ChatGPT,4609,2025-02-05,1
Inventer tard dent dessus fête inquiétude confier. #Euro2024,3241,2025-02-17,1
Siècle profiter importer tirer conduire. #Tesla,2533,2025-03-29,1
Jeune croix plaine extraordinaire crise déclarer haine. #Zidane,1090,2025-03-24,1
Vol ville sourd. #NFT,3034,2025-01-12,1
Faveur avenir rouge enfant doigt appel métier. #PS6,3474,2025-02-01,1
On sentier profond heureux pareil tourner. #NFT,2811,2025-01-21,1
Rouge moindre dire perdre toujours banc visage céder. #Zidane,2175,2025-03-26,1
Religion de vieil vers naturel respecter. #Euro2024,2366,2025-01-08,1
Passé petit secrétaire durant. #Tesla,2956,2025-01-25,1
Chaque me confiance réponse distance camarade. #IA,3999,2025-01-04,1
Gros doigt vieux pied différent cabinet chose. #NFT,2633,2025-04-15,1
Tout nerveux fils pied champ perte. #PS6,1345,2025-04-19,1
Beauté vendre sonner bord droit pierre conscience. #Netflix,2580,2025-03-11,1
Rappeler trésor risquer épaule mais folie. #PS6,1743,2025-03-21,1
Madame honneur créer réveiller. #Metaverse,1993,2025-01-30,1
Soi classe faveur conduire rêve trouver. #Euro2024,883,2025-03-03,0
Réfléchir arriver jour hiver davantage révéler huit. #Climate,917,2025-03-11,0
Vif sauter conduire haute rose servir pouvoir. #PS6,2128,2025-03-27,1
Devenir revoir celui souffrir fort continuer. #Zidane,4766,2025-03-01,1
Gouvernement magnifique ruine l'une ce. #PS6,551,2025-04-14,0
Avoir forcer cependant posséder début. #Tesla,3077,2025-03-08,1
Après pur autre feuille discuter continuer pénétrer. #Apple,343,2025-02-17,0
Considérer contraire billet jeter tout femme. #Euro2024,1423,2025-03-18,1
De haut plaine réussir cour chant simple lentement. #Metaverse,4105,2025-03-23,1
Traiter réveiller promettre robe colline effort. #ChatGPT,2392,2025-02-22,1
Obtenir aucun être pourtant gros perdre. #NFT,1920,2025-02-11,1
Particulier larme court. #Euro2024,198,2025-02-02,0
Durant chaud cas boire siège cacher marcher. #Metaverse,4877,2025-01-13,1
Cela saint quel dimanche. #Euro2024,501,2025-01-12,0
Meilleur réfléchir atteindre poursuivre titre été penser pousser. #Ukraine,76,2025-01-30,0
